author,book_url,flowers,image_urls,images,monthly_clicks,rating,rewards,summary,tags,title,word_count
过春风十里,https://b.faloo.com/1470085.html,5229,http://img.faloo.com/Novel/332x470/1/1573/001573184.jpg,full/001573184.jpg,月点击：729826,9.4,900,"【飞卢小说网独家签约小说：盘点十大功法，他化自在吓尿万界】
叶天穿越到全球高武的世界，却因没有修炼天赋，让他绝望。
好在他绑定一个诸天视频剪辑系统，可剪辑视频发布诸天万界。
叶天打造上传了《盘点万界十大逆天功法》。
焚诀！九秘！太上忘情录！逆乱八式！神象镇狱劲！
他化自在！他化万古！他化一切！
无龙心法！天下无龙！人人如龙！
看到荒天帝映照诸天，背负一切因果，复活整个三部曲！更是吓尿万界！！
太上老君：“居然这他化自在法，比起我的一气化三清还厉害！”
帝尊：“我们遮天世界难道只是被映照的虚幻世界？？”
安澜：“我日后如此会装逼？”
狠人大帝：“我的吞天魔功上榜单了？求仙榜主人仙帝大人告诉哥哥下落！”
杨大象：“我的神象镇狱劲不入前三？？”
之后，叶天发现居然真可获得奖励，激动的连发视频，盘点祭道之上……
飞卢小说网提醒您：本小说及人物纯属虚构，如有雷同，纯属巧合，切勿模仿。","直播,万界,轻小说",盘点十大功法，他化自在吓尿万界,字数：76万
皮罗,https://b.faloo.com/1470119.html,18802,http://img.faloo.com/Novel/332x470/1/1581/001581044.jpg,full/001581044.jpg,月点击：729866,9.6,2788,"【飞卢小说网独家签约小说：盘点叙事层概念，狼叔强哥惊万界】
曝光万界接触到叙事层概念的世界。
第一个十冷世界：概念神河神！多元宇宙管理员小金刚！漫画当中一巴掌能将人拍飞到叙事层世界，让其灰飞烟灭的哪吒。
面对一个个登场的逆天怪物，万界震撼至极。
而随着叙事层人类曝光，万界吓傻了。
冥王：这就是世界的真相吗？万界当中的生灵，不过是叙事层人类随手创造的！
凉冰：叙事层人类，是超越万界之上的绝对神明！
萧炎：万界当中的生灵，只要踏入叙事层世界就会灰飞烟灭！
第二个喜灰世界更是吓麻万界。
灰太狼所造的拜拜机能跨越叙事阶梯，成为货真价实的叙事层人类！象星石，黑暗能量，时空管理局全都是他一手缔造！
此外狗熊岭，比奇堡。
飞卢小说网提醒您：本小说及人物纯属虚构，如有雷同，纯属巧合，切勿模仿。","综漫,盘点",盘点叙事层概念，狼叔强哥惊万界,字数：62万
雨中源,https://b.faloo.com/1450380.html,262015,http://img.faloo.com/Novel/332x470/1/1551/001551104.jpg,full/001551104.jpg,月点击：729892,9.4,2.3万,"【飞卢小说网独家签约小说：综漫:从地错开始的魔法师之旅】
穿越到地错世界，罗兰不仅身无分文，同时身体还变成小孩。
本以为自己会在这个世界悲惨的生存下去，脑海却突然出现一个屏幕。
它将罗兰的身体改造成拥有黑暗之眼，掌握五大职业力量的魔法师。
在亚丽榭的邀请下，罗兰加入了阿斯特莉亚眷族。
为了能在这个剑与魔法的世界生存下去，加入眷族，探索魔法师之路。
踏上无限之旅，最后变成最强。
(暂定)主线地错
飞卢小说网提醒您：本小说及人物纯属虚构，如有雷同，纯属巧合，切勿模仿。","二次元,综漫,轻小说",综漫:从地错开始的魔法师之旅,字数：58万
龙蛇2025,https://b.faloo.com/1463991.html,13387,http://img.faloo.com/Novel/332x470/1/1565/001565441.jpg,full/001565441.jpg,月点击：730638,9.9,100,"【飞卢小说网独家签约小说：港片：地下教父，你管我叫议员？】
【2025港片扛鼎之作】
穿越八十年代港片世界，连浩南绑定慈善系统，成为连浩龙的三弟。
只要积善行德，就有丰厚奖励。
【叮，你挂掉了阿发，奖励街机工厂】
【叮，你挂掉了公伯，奖励超级士兵血清】
【叮，你挂掉了靓坤，奖励万艾可配方】
连浩南：
“摊牌了，我不装了。”
“众所周知，我这个人最喜欢做善事了。”
“什么地下教父？没有的事，小心告你诽谤。”
“我一慈善天尊，不出来竞选议员，谁敢出来？”
“港督，我连浩南一片赤诚忠心为港，却总有虫豸污蔑我有不轨之图，你说本特首该怎么办呀？”
飞卢小说网提醒您：本小说及人物纯属虚构，如有雷同，纯属巧合，切勿模仿。","港片,港综,港岛",港片：地下教父，你管我叫议员？,字数：47万
浅海的小龙虾,https://b.faloo.com/1069939.html,1255992,http://img.faloo.com/Novel/332x470/0/855/000855572.jpg,full/000855572.jpg,月点击：730650,10,12.3万,"【飞卢小说网独家签约小说：武侠：邀月派我，卧底锦衣卫】
来到综武世界，被邀月、怜星捡到，送去朝廷‘锦衣卫’中卧底，手持圆月弯刀，身怀明玉神功的林无忧，就这样一步步成为了锦衣卫指挥使。
【叮，晋升锦衣卫千户，奖励：人物抽奖‘南宫仆射’】
【叮，晋升锦衣卫指挥使，奖励：人物抽奖‘焰灵姬’】
这是综武江湖，有武当张三丰，有密宗八思巴，有大明葵花老祖，有魔宗蒙赤行。
有慈航静斋梵清惠，师妃暄，有阴葵派祝玉妍，婠婠。
有盗圣白展堂，有盗王司空摘星。
有天涯海阁李秋水，有日月神教教主东方不败。
有西厂，有东厂，有锦衣卫，有六扇门。
赵敏：此人让我蒙元损失惨重。
柳若馨:我要把你的眼睛挖出来。
婠婠：师尊，我对他动心了..
飞卢小说网提醒您：本小说及人物纯属虚构，如有雷同，纯属巧合，切勿模仿。","爽文,系统,同人",武侠：邀月派我，卧底锦衣卫,字数：792万
鹰酱小三,https://b.faloo.com/1466868.html,36520,http://img.faloo.com/Novel/332x470/1/1568/001568884.jpg,full/001568884.jpg,月点击：730778,8.0,7888,"【飞卢小说网独家签约小说：综漫：我编的日记她们都信了】
只要写日记让拥有日记副本的人相信了日记内容就会成真？
既然如此，那么可就别怪我瞎编了。
作为穿越者的周防尊可太知道这个日记该怎么编了。
只是编着编着，这些个二次元的女主角咋就都围绕在我身边了呢。
哦，日记副本持有者啊，那没事了。
飞卢小说网提醒您：本小说及人物纯属虚构，如有雷同，纯属巧合，切勿模仿。","二次元,综漫",综漫：我编的日记她们都信了,字数：62万
风影,https://b.faloo.com/1127885.html,2000901,http://img.faloo.com/Novel/332x470/0/841/000841055.jpg,full/000841055.jpg,月点击：731152,10,82.4万,"【飞卢小说网独家签约小说：全球穿越之群星帝国】
2030年的某天，一觉醒来的人们突然发现了来自宇宙的访客——自称来自人类联邦的一艘科研舰，向地球通报了这样一个事实：
太阳系完成了自诞生以来最伟大的壮举，包括整个地球在内，整个星系脱离了原宇宙，来到新宇宙。
在这片广袤的星空之中，文明光辉照耀不到的黑暗星系里，无数的npc势力一遍又一遍地刷新，萌芽中的生命星球从此之后，失去了向往太空的权利，而文明的国度，正在遭到无尽噩梦的侵袭，日渐衰落。
护卫舰、驱逐舰、巡洋舰、战列舰、旗舰、泰坦...
空间站、太空港、星堡、星际要塞、擎天堡、战星...
灵能飞升、机械飞升、基因飞升，进化之路无穷尽。
文明诞生英雄，英雄开创史诗，此宇宙，唯英雄不朽！
飞卢小说网提醒您：本小说及人物纯属虚构，如有雷同，纯属巧合，切勿模仿。","争霸,科幻,网游",全球穿越之群星帝国,字数：742万
稀缺老年人,https://b.faloo.com/1459183.html,38744,http://img.faloo.com/Novel/332x470/1/1558/001558475.jpg,full/001558475.jpg,月点击：731166,9.7,888,"【飞卢小说网独家签约小说：我是刑警，我祁同伟调来了】
祁同伟！
一觉醒来，发现自己居然穿越了人民的世界，并且还成为那个誓要胜天半子的祁厅长？
完了！完了！难不成最后真要踏上孤鹰岭的绝路？
高育良:什么？同伟啊！你要去中昌？你疯了？
陈阳:呜呜呜。同伟。你是不是不要我了？
小琴:厅长，哦，不，祁队长，你看我行吗？
秦川:啧，不是，老祁啊，你不是政法出身吗？怎么破案你也会？
（简介无力，看正文吧！）
飞卢小说网提醒您：本小说及人物纯属虚构，如有雷同，纯属巧合，切勿模仿。","反派,破案,刑侦",我是刑警，我祁同伟调来了,字数：72万
灰虎,https://b.faloo.com/1328463.html,1574990,http://img.faloo.com/Novel/332x470/1/1026/001026068.jpg,full/001026068.jpg,月点击：723884,9.9,57.4万,"【飞卢小说网独家签约小说：港片：百兽爆兵，我是黑龙王】
陈黑龙重生港片世界，成为了和联胜新界地区的堂主，绰号财神龙。
这一天，陈黑龙激活百兽系统，召唤百兽王者化形为人，赐名黑虎王，黑狼王，黑熊王，从此，陈黑龙手下小弟无数，横扫无敌。
陈黑龙：“我有无数强横小弟，当横推港岛，杀入国外，第一步，一统和联胜。”
邓伯：“你还年轻，资历不够！”
陈黑龙：“送你下去吃稀，老东西。”
飞卢小说网提醒您：本小说及人物纯属虚构，如有雷同，纯属巧合，切勿模仿。","权谋,创业,港综",港片：百兽爆兵，我是黑龙王,字数：284万
一元为始,https://b.faloo.com/1441521.html,131735,http://img.faloo.com/Novel/332x470/1/1460/001460283.jpg,full/001460283.jpg,月点击：724019,9.8,400,"【飞卢小说网独家签约小说：武侠之开局百倍悟性】
主角开局截胡张无忌的机缘，从此江湖上多了一个陌上人如玉的绝顶高手。邀月看到江枫之后直接鄙视道：传说中的江湖第一美男子？就这？
黄蓉看到林州，再看看自己身边的傻大个，突然觉得自己是不是脑袋抽筋了？居然觉得傻大个值得托付？难道自己中了蛊毒？
王语嫣面对和自己长得一毛一样的小龙女突发奇想。该不会自己娘亲当初生的是双胞胎吧？
十岁林黛玉拉着一颗大柳树：叔叔，你看我抗议倒拔杨柳了。
飞卢小说网提醒您：本小说及人物纯属虚构，如有雷同，纯属巧合，切勿模仿。","武侠,天赋",武侠之开局百倍悟性,字数：97万
单抽出金,https://b.faloo.com/1454396.html,97183,http://img.faloo.com/Novel/332x470/1/1552/001552183.jpg,full/001552183.jpg,月点击：724279,9.8,3088,"【飞卢小说网独家签约小说：原神：第四天灾，碾压纳塔战争】
梁川穿越提瓦特，觉醒【第四天灾】系统，成为宇宙级“黑心老板”——
玩家打工他抽成！召唤越多，战力越强！
玛薇卡：“为什么，这些外来者没有古名也不需要还魂诗便可以复活？”
芙芙：“啊？！到底是谁在加价卖我演出的黄牛票？！”
天理：“怎么会有如此多僭越之人在我面前叫我亮血条？！”
...
不多久，一辆星穹列车打破了提瓦特的“壳”穿梭而来。
第四天灾征途，就此开启大宇宙时代！
三月七：“糟了！开拓者多到车厢都塞不下啦！”
流萤：“这些人的生命力...怎么比繁育虫**都要强？”
卡芙卡：“他们的头目...那个叫梁川的，为什么一直管我叫妈呢？”
飞卢小说网提醒您：本小说及人物纯属虚构，如有雷同，纯属巧合，切勿模仿。","网游,原神",原神：第四天灾，碾压纳塔战争,字数：70万
复苏骑士,https://b.faloo.com/1369285.html,444782,http://img.faloo.com/Novel/332x470/1/1586/001586477.jpg,full/001586477.jpg,月点击：724373,9.9,10.5万,"【飞卢小说网独家签约小说：柯学：妃英理怀孕，开局时停】
重生柯南世界，成为恶魔的秋月诚收割亡灵就能抽奖。
在柯南身后，捡魂变强。时停，亿万美金，体质99……
回家的小兰看到，穿着JK服的妃英理依偎在秋月诚怀里。
小兰眼眸失去亮光，“看来我来的不是时候，不对！为什么还穿我的衣服！”
看到秋月诚身后又出现个同样打扮的妃英理，小兰傻眼。
“对不起，我的天使。”易容成妃英理的贝尔摩德，没想到小兰会出现。
“别躲了，看见了。”试图躲到沙发后同样易容成妃英理的有希子被抓住。
“三个都一样！”小兰表示分不清但大受震撼。
飞卢小说网提醒您：本小说及人物纯属虚构，如有雷同，纯属巧合，切勿模仿。","后宫,柯南,柯学",柯学：妃英理怀孕，开局时停,字数：179万
君启,https://b.faloo.com/1473672.html,10804,http://img.faloo.com/Novel/332x470/1/1578/001578402.jpg,full/001578402.jpg,月点击：724687,9.8,0,"【飞卢小说网独家签约小说：僵尸：我摸尸就变强，九叔人傻了】
林墨穿越僵尸与盗墓融合的大世界，被九叔捡回义庄。
本想拜师九叔，奈何此时的世界处于末法时代。
天地之间灵气衰微，修炼资源匮乏，修道者举步维艰。
好在他及时觉醒“摸尸就变强”系统。
摸尸便可获得尸体生前的技能、功法、修为、财富、寿命等等。
摸尸码头工人，加点力量属性，一拳摧山断河。
摸尸书生，获技能词条“文曲星照”，可瞬间参悟任何功法。
摸尸死亡时间小于三天的尸体，获其部分寿命。
摸尸鲁殇王血尸获“阴兵虎符”，摸尸精绝女王获“虚数之眼”，摸尸献王尸获“雮尘珠”…………
不知不觉间，林墨已经踏上仙途，长生久视，俯瞰众生。
飞卢小说网提醒您：本小说及人物纯属虚构，如有雷同，纯属巧合，切勿模仿。","僵尸,盗墓,九叔",僵尸：我摸尸就变强，九叔人傻了,字数：42万
谋之杨,https://b.faloo.com/1466522.html,102335,http://img.faloo.com/Novel/332x470/1/1568/001568526.jpg,full/001568526.jpg,月点击：724873,9.9,2.1万,"【飞卢小说网独家签约小说：抗战:一呼吸一块大洋，川军雄起】
主角张抗，穿越到抗战时期，成为一名川军连长。
开局身处淞沪战场，携带呼吸涨钱系统。
系统LV1:一次呼吸一块大洋。
系统LV2:一次呼吸两块大洋。
系统LV3:一次呼吸四块大洋。
……
花费10万大洋，系统等级LV2。
花钱100万大洋，系统等级LV3。
花钱1000万大洋，系统等级LV4。
……
系统自带商城，武器弹药、日常物资通通都有。
步枪，10大洋。
冲锋枪，50大洋。
重机枪，1000大洋。
150mm榴弹炮，1万大洋。
B29轰炸机、20万大洋。
……
核动力航空母舰，售价***
这个川军太富裕了!
张抗:“所有人都不看好川军，偏偏川军最争气!”
格老子的，川军绝不拉稀摆带!
川军，雄起!
打爆鬼子，横推列强，殖民全球!
飞卢小说网提醒您：本小说及人物纯属虚构，如有雷同，纯属巧合，切勿模仿。","争霸,铁血,金钱",抗战:一呼吸一块大洋，川军雄起,字数：62万
唐初二十一,https://b.faloo.com/1474310.html,3910,http://img.faloo.com/Novel/332x470/1/1579/001579244.jpg,full/001579244.jpg,月点击：725335,9.7,100,"【飞卢小说网独家签约小说：盘点诸天至高：从红毛怪到蓝白社】
刷的短视频意外被投放到万界，只要反应就能获得奖励
开局盘点万界十大至高世界
【TOP10：一叶遮天世界】
有当镇压世间一切敌的天帝！弹指间便能灭宇宙亿万生灵！
更有被冠以全宇宙最为恐怖的东荒生命禁区！
黑暗动乱的源头更是在此！
···
【TOP9：完美大世界】
谁敢称无敌？哪个敢言不败？一剑独断万古！
唐叁：什么？我的神王境放在完美大世界里竟然不过区区搬血境？
在看到完美大世界曝光出后，人族大帝之战！抬手间便能随手爆星！
诸天万界全傻眼了！
···
【TOP8：圣墟大世界】
祭海一朵浪花，便是三千大宇宙。祭道之上，无限盒子！
侥幸哥：本以为斗帝已是巅峰，没想到还有更强的世界？
···
而在蓝白社世界曝光出来后，万界彻底吓尿了！
飞卢小说网提醒您：本小说及人物纯属虚构，如有雷同，纯属巧合，切勿模仿。","重生,成长,二次元",盘点诸天至高：从红毛怪到蓝白社,字数：67万
潇潇暮雨风未停,https://b.faloo.com/1470571.html,19065,http://img.faloo.com/Novel/332x470/1/1573/001573888.jpg,full/001573888.jpg,月点击：725384,10,400,"【飞卢小说网独家签约小说：特种兵：开局从威慑边境开始】
一觉醒来，原龙国丛林利剑教官凌战锋穿越到特种兵世界，重回十八岁，再次进入军队的时候。
边境，凌战锋悍然出击，无数毒贩葬身于边境，一时间夏国边境成为毒贩和武装分子的禁区。
狼牙，何志军看着手中的请功报告皱着眉头
高大壮看着将孤狼B带领成为全能特战的凌战锋嘴角抽搐。
曾经战功赫赫的的凌战锋在次将自己的代号响彻整个边境。
凌战锋看着改变的剧情，无奈的看着身后同样功勋满身的众人，不是我们军功章多，是觊觎祖国大好河山的人太多。
飞卢小说网提醒您：本小说及人物纯属虚构，如有雷同，纯属巧合，切勿模仿。","重生,特种兵,军人",特种兵：开局从威慑边境开始,字数：51万
孤涯长漠,https://b.faloo.com/1442753.html,212393,http://img.faloo.com/Novel/332x470/1/1521/001521407.jpg,full/001521407.jpg,月点击：725413,9.8,2.6万,"【飞卢小说网独家签约小说：影视：人在诸天成就战力天花板】
获得诸天战力天花板系统的陆轻舟，开启了穿越诸天世界的征途。
神级词条【质高一等】：你拥有极高的天赋，学习任何技艺的资质，都比资质最好的人，还要高出一个等级！
【天道酬勤】：只要付出就会有回报，努力越多收获越多，让您摆脱对资源的依赖！
射雕世界，成为超越五绝的绝顶强者、射雕话事人，灭西夏、平金国，战蒙古、克吐蕃一统华夏！
庆余世界，弱冠之年成就大宗师，凭借无上才情，创神级功法，成就最强宗师。
凡人世界，他法体双修，以结丹修为逆伐元婴，成为人界第一修士。
吞噬世界，他是地球第一天才，巅峰天才战上凭借无敌的实力碾压宇宙各路天骄，最终带领地球人类成为宇宙最强种族！
大世界（以战斗历练为主）奋发向上，小世界（以都市或古偶日常剧为主）享受生活和爱情。
一路行来，主角已经是万界第一人。
飞卢小说网提醒您：本小说及人物纯属虚构，如有雷同，纯属巧合，切勿模仿。","成长,升级练,万界",影视：人在诸天成就战力天花板,字数：127万
黑白的假面,https://b.faloo.com/634550.html,3286156,http://img.faloo.com/Novel/332x470/0/442/000442616.jpg,full/000442616.jpg,月点击：725551,10,42.5万,"【飞卢小说网独家签约小说：神奇宝贝：完美开局】
重生了，而且重生后还是小智？和原著的世界不同的是旅行时间是15岁？看来可以开始自己的操作了！
这是一位旅行前就开始赚钱的小智，这是为旅行前就开始训练精灵的小智，当他出发的时候，已经是一位大佬级的人物了。
小智：对战？没问题！吉利蛋变圆加剧毒
大木博士：小智！快叫喵喵来！
希罗娜：来份冰激凌
科拿：狩猎开始
瑟蕾娜：约定好了
露莎米奈：打断你的四肢带在身边照顾好了…
坂木：女婿，咱们爷俩练练
动画与原创为主，不是游戏版的4个技能的世界。
飞卢小说网提醒您：本小说及人物纯属虚构，如有雷同，纯属巧合，切勿模仿。","爽文,同人,热血",神奇宝贝：完美开局,字数：1127万
人生气氛组,https://b.faloo.com/1437063.html,242197,http://img.faloo.com/Novel/332x470/1/1375/001375195.jpg,full/001375195.jpg,月点击：725864,9.7,2.3万,"【飞卢小说网独家签约小说：影视：少年白马开始的吃瓜剑客】
这江湖。
胜者为仙，败者为邪。
掌握话语权的既是正，随心所欲的则是魔。
苏久来到这个世界，非仙、非邪、非正、非魔，他只想看看戏、吃吃瓜、找找乐子。
当然了......
名剑、美酒、绝世佳人，
一个不少！
飞卢小说网提醒您：本小说及人物纯属虚构，如有雷同，纯属巧合，切勿模仿。","爽文,同人,美女",影视：少年白马开始的吃瓜剑客,字数：204万
可爱,https://b.faloo.com/1470946.html,10233,http://img.faloo.com/Novel/332x470/1/1574/001574167.jpg,full/001574167.jpg,月点击：725906,9.5,8000,"【飞卢小说网独家签约小说：大秦：开局成墨家巨子，百家独尊】
公元前250年，秦国又迎来了一个新的王——秦庄襄王继位，而同样就在这一年，墨家也是即将迎来属于他们的新任巨子。
墨玉，一位转世重生之人，墨子第九世孙，身份天赋惊人，他也是在这一年正式踏入这纷乱的乱世江湖。
但在这之前天下已然大变，黑水涛涛，遍行天下！墨玉，先为韩墨首领，随后更是参与墨家推选，一举夺魁成为墨家巨子！
七国纷争，百家论道，名剑美人，金戈铁马，阴谋轨迹，刀光剑影！
对于这一些，墨玉只有一句话那就是百家吾为尊，天下吾定鼎！
飞卢小说网提醒您：本小说及人物纯属虚构，如有雷同，纯属巧合，切勿模仿。","重生,大秦",大秦：开局成墨家巨子，百家独尊,字数：49万
叫我相公,https://b.faloo.com/1096976.html,1944174,http://img.faloo.com/Novel/332x470/0/797/000797302.jpg,full/000797302.jpg,月点击：726089,10,5.3万,"【飞卢小说网独家签约小说：游戏王：开局阴间卡组，致郁世界】
江合穿越决斗世界，激活【最强决斗致郁系统】，开局一套阴间卡组。
只要致郁对手，就能得到对手的情绪值奖励，从系统兑换各种卡组与能力。
极致削血流卡组，阴间诱惑卡组，以及看到卡牌精英，让精灵实体化的能力等等...
黑魔导女孩：我打算跟随江合，啾咪！
江合：决斗就是要给对方带来“致郁”的“微啸”！
飞卢小说网提醒您：本小说及人物纯属虚构，如有雷同，纯属巧合，切勿模仿。","爽文,后宫,搞笑",游戏王：开局阴间卡组，致郁世界,字数：677万
果冻泡泡,https://b.faloo.com/1460068.html,20048,http://img.faloo.com/Novel/332x470/1/1559/001559853.jpg,full/001559853.jpg,月点击：726273,9.9,100,"【飞卢小说网独家签约小说：四合院：预支未来，娶妻陈雪茹】
秦长顺穿越到50年的情满四合院的世界之中成为了乡下的一个孤儿。
本以为无依无靠地狱开局。
但没想到他就觉醒了预支未来系统。
只要完成任务便可以预支自己未来的能力。
开局预支了打猎的能力，刚用打猎能力完成系统任务就被通知去继承四九城的遗产，本以为好日子了来了，但没想到他继承的是禽兽的四合院。
刚入四合院贾张氏便打上了他房子的主意，但秦长顺也不是那么好欺负的。直接反击贾张氏。
还将秦淮如嫁到贾家的机会给搅浑了。
叮！预支未来获得八级钳工能力！
叮！预支未来获得神级大厨能力！！
飞卢小说网提醒您：本小说及人物纯属虚构，如有雷同，纯属巧合，切勿模仿。","重生,扮猪吃,都市",四合院：预支未来，娶妻陈雪茹,字数：83万
半路出道,https://b.faloo.com/1475500.html,45667,http://img.faloo.com/Novel/332x470/1/1581/001581469.jpg,full/001581469.jpg,月点击：726438,10,688,"【飞卢小说网独家签约小说：黑暗迪迦：从灌顶居间惠开始进化】
穿越迪迦世界，成为黑暗迪迦，只要吞噬就能百倍提升，无限进化！
从此，叶枫开启了肆意妄为的人生！
居间惠捏肩，丽娜吹箫，幽怜鸣笛。
卡蜜拉和卡尔蜜拉捶腿。
天照和伊萨那女王跳舞。
格丽乔奉茶，奥母为仆。
当回过神，叶枫发现，自己已经留下了许多传奇。
吞邪神加坦杰厄，吸收等离子火花塔，培养极恶贝利亚。
囚奥王，噬诺亚。
将奥界四大天花板统统吸收！
叶枫表示，黑暗迪迦，将会是各大宇宙唯一的，终极黑暗！
飞卢小说网提醒您：本小说及人物纯属虚构，如有雷同，纯属巧合，切勿模仿。","奥特,迪迦,奥特曼",黑暗迪迦：从灌顶居间惠开始进化,字数：22万
