author,book_url,flowers,image_urls,images,monthly_clicks,rating,rewards,summary,tags,title,word_count
暴燥老哥,https://b.faloo.com/1472232.html,37278,http://img.faloo.com/Novel/332x470/1/1576/001576349.jpg,full/001576349.jpg,月点击：765823,9.8,2352,"【飞卢小说网独家签约小说：原神：虚无岁阳，开局吞噬芙宁娜】
穿越原神，夏夜竟成为一只来自星铁的岁阳。
开局撞见煎熬500年、独自哀叹“还要等多久”的芙宁娜。
并觉醒系统，可吞噬对方情绪、转化力量。
于是夏夜直接吞噬芙宁娜的哀伤。
却不料自身受到影响，踏上虚无命途，可吞、挂各种负面，自己却没有干劲。
芙宁娜.干劲满满版：你这么强，不要开摆啊！
为了让夏夜发挥更多作用，也为了让众人一起帮他重拾干劲、摆脱虚无，芙宁娜联系诸国。
温迪：谁给我挂的一杯就醉？
若陀：竟能吞噬磨损？义父救我！
神子：将军以身入局，成功令他重拾干劲、召魂友人，如今产假中。
树王：你说...禁忌知识有我的味道？
火神：吞完深渊你成令使了？令使是..
飞卢小说网提醒您：本小说及人物纯属虚构，如有雷同，纯属巧合，切勿模仿。","搞笑,原神,名场面",原神：虚无岁阳，开局吞噬芙宁娜,字数：27万
火红的椰子,https://b.faloo.com/1472559.html,39145,http://img.faloo.com/Novel/332x470/1/1576/001576740.jpg,full/001576740.jpg,月点击：766237,9.3,2376,"【飞卢小说网独家签约小说：综漫阴阳师，开局救下四谷见子】
晴明一觉醒就穿越到了综漫的世界。
好消息：身穿的同时还绑定了穿越者必备的系统。
坏消息：这个世界不止存在各种各样的恶灵妖怪，还有各种传闻中的都市传说，什么裂口女、贞子、伽椰子、厕所里的花子......
不过好在，绑定系统之后，晴明成为了一名传说中的阴阳师。
不仅有各种强大的能力傍身，还可以召唤各种各样的式神为自己而战！
而他的目标，是在成为这个最强阴阳师的同时，打造一个大大的水晶宫！
........
四谷见子：只有待在晴明先生的身边，我才会感到安心。
海老名菜菜：晴明先生，请不要在这里....唔.....
霞之丘诗羽：撒~晴明君是喜欢白色的还是黑色呢？
薙切绘理奈：接下来换我尝尝你的味道了。
桐谷直叶、亚丝娜、四宫辉夜、藤原千花、英梨梨、周防有希.......
飞卢小说网提醒您：本小说及人物纯属虚构，如有雷同，纯属巧合，切勿模仿。","二次元,综漫,恐怖",综漫阴阳师，开局救下四谷见子,字数：48万
主播神起,https://b.faloo.com/1469160.html,280912,http://img.faloo.com/Novel/332x470/1/1573/001573423.jpg,full/001573423.jpg,月点击：767385,9.9,1100,"【飞卢小说网独家签约小说：娱乐：合欢变强，力捧杨蜜景恬】
苏尘重生18岁，获得神级词条系统。
发歌，拍电视剧，成为顶级流量，引发各路美女跪求合作。
大蜜蜜：“感谢男神带飞。不要问，问就是《爱的供养》。”
景恬：“我最想感谢的人是苏尘，他是我的神。”
娜扎：“学长，我在房间里等你。”
李吣：“鸡腿姑娘还有半小时抵达战场，请夫君耐心等待。”
飞卢小说网提醒您：本小说及人物纯属虚构，如有雷同，纯属巧合，切勿模仿。","娱乐,明星,写歌",娱乐：合欢变强，力捧杨蜜景恬,字数：70万
吃鸭,https://b.faloo.com/1411244.html,150762,http://img.faloo.com/Novel/332x470/1/1585/001585608.jpg,full/001585608.jpg,月点击：767506,9.8,2.1万,"【飞卢小说网独家签约小说：二创震撼名场面，故事之神洛基！】
苏辰获得‘万界混剪’，只要二创短视频并传播至万界，便可获得奖励。
于是...【二柱子爆杀宿傩】【继国缘一娶妻无惨】【卫宫士郎家的饭】【暴君熊的一生】
【路明非与绘梨衣婚礼】【洛基成为多元之主】【鹿目圆与晓美焰不可说的秘密】等等
当一幕幕未来过去现在景象出现在万界众人眼前，万界疯了。
鬼舞辻无惨：“我...嫁给了继国缘一？！！还给他生了孩子？！”
鸣人：“可恶！佐助居然也有高光时刻，明明我才是主角啊！”
雷神索尔：“多元之主，呜呜，洛基你真混蛋啊！”
路明非：“我爱的是诺诺学姐，才不是绘梨衣啊！”
晓美焰：“小圆，你听我解释”
磁场颠佬，上条教主数亿次死亡，莱..
飞卢小说网提醒您：本小说及人物纯属虚构，如有雷同，纯属巧合，切勿模仿。","爽文,系统,同人",二创震撼名场面，故事之神洛基！,字数：192万
酸味柠檬,https://b.faloo.com/1472930.html,138286,http://img.faloo.com/Novel/332x470/1/1577/001577252.jpg,full/001577252.jpg,月点击：768992,8.5,8.1万,"【飞卢小说网独家签约小说：人在里番当和尚，开局为夫人灌顶】
假和尚修缘肉身穿越到了一个全新世界。
身为三无人员的他，开局就重拾旧道，假扮和尚为全职太太灌顶！
等等，这位太太是高柳家的媳妇？她叫美津子？
这是里番世界！
住在隔壁的一家有个叫秋月爱莉的金发女孩。
学校里有研究魔法，召唤恶魔的女校医？
还有身材高大的八尺夫人、蜘蛛女、来自深渊的魅魔……
对此觉醒功德系统获得密宗修炼法门的修缘笑了。
将痴汉，黄毛扒皮抽骨练成法器！
降服八尺夫人，魅魔，蜘蛛女，作为明妃！
爱莉乖，大师亲自给你灌顶！
飞卢小说网提醒您：本小说及人物纯属虚构，如有雷同，纯属巧合，切勿模仿。",综漫,人在里番当和尚，开局为夫人灌顶,字数：43万
汽水不胖,https://b.faloo.com/1476205.html,36682,http://img.faloo.com/Novel/332x470/1/1582/001582596.jpg,full/001582596.jpg,月点击：769931,9.8,988,"【飞卢小说网独家签约小说：港片:让你走私，你大飞撞军舰？】
陈文虎穿越港片世界，成为和联胜一名四九仔，和占米一起搞走私。
不仅觉醒走私10倍暴击奖励系统，还得到了声望值系统商城！
走私电器，10倍暴击，一夜赚百万。
走私黄金，10倍暴击，一夜赚千万！
十吨大飞九吨油，一吨双狮踏地球……
随着声望值越多，陈文虎便能通过声望兑换各种武器，装备！
当陈文虎走私遇到鬼老巡逻军舰的时候，陈文虎直接开着大飞撞了上去，手持AK扫荡整个军舰鬼老！
从此斗洋行，拍电影，搞军工，弄四大家族买办。
一步一步！
衣，食，住，行，金融，地产，能源，军工，芯片…
陈文虎的产业遍布全世界！
世界船王，走私帝国，世界军阀，世界第六流氓……
“这个世界，我陈文虎话事！”
飞卢小说网提醒您：本小说及人物纯属虚构，如有雷同，纯属巧合，切勿模仿。",港片,港片:让你走私，你大飞撞军舰？,字数：39万
思空M,https://b.faloo.com/1471093.html,17471,http://img.faloo.com/Novel/332x470/1/1574/001574889.jpg,full/001574889.jpg,月点击：770026,9.9,688,"【飞卢小说网独家签约小说：海贼:洛克斯时代开始建立家族】
这一年海上最强海贼团还是洛克斯海贼团，海贼王罗杰还没找到ONEPECE,未来的海军最高战力还再成长。
夏天因被卡车创飞而来到了海贼王的世界，开起了收集恶魔果实陪养孩子打造海贼世界最强家族的道路。
欲知后事如何请听正文！
飞卢小说网提醒您：本小说及人物纯属虚构，如有雷同，纯属巧合，切勿模仿。","成长,二次元,航海",海贼:洛克斯时代开始建立家族,字数：75万
花落剑收鞘,https://b.faloo.com/1438196.html,72046,http://img.faloo.com/Novel/332x470/1/1376/001376547.jpg,full/001376547.jpg,月点击：771946,9.9,4488,"【飞卢小说网独家签约小说：次元金榜：盘点万界名场面】
阿尔萨斯：王权没有永恒，而你将加冕为王！
托尼斯塔克：凡人之躯，比肩神明，我是钢铁侠！
孙悟空：九重天上有威风，十万军中无敌手！
地狱咆哮：兽人永不为奴，我们必将为王！
二爷：区区华雄，某去去就来！
李淳罡：山不来就我，我不去就山，有山在前拦去路，我就为后来人开山！
杨间：张羡光，随我去终结灵异时代！
刀锋女王：我既是虫群！
祖国人：月牙天冲，老子想干嘛就干嘛！
.........
阿修罗之怒，星际争霸，魔兽，吞噬星空，海贼，ben10，剑来，哥斯拉......！
飞卢小说网提醒您：本小说及人物纯属虚构，如有雷同，纯属巧合，切勿模仿。","同人,万界,名场面",次元金榜：盘点万界名场面,字数：191万
幂巴菲圆颖,https://b.faloo.com/1451656.html,147207,http://img.faloo.com/Novel/332x470/1/1549/001549070.jpg,full/001549070.jpg,月点击：772147,9.5,10.2万,"【飞卢小说网独家签约小说：娱乐：觉醒曹贼系统，杨蜜嗨了】
林昊穿越到平行世界，觉醒了曹贼系统。
只要不断从别人家老婆身上，激发自己的曹贼属性，就能随机掉落词条。
【霸王枪】（青色词条）：超越转轮王嫪毐的绝世神兵，翻江倒海，女神最爱。
【大导演】（紫色词条）：超越奥斯卡顶尖导演的水准，电影教父。
【投资天才】（紫色词条）：远超股神巴菲特的史诗级投资能力，撼动华尔街。
只要当好一个曹贼，林昊就能一步步踏上食物链最顶端。
杨蜜，热巴，赵莉颖，刘师师，唐焉，大甜甜……
飞卢小说网提醒您：本小说及人物纯属虚构，如有雷同，纯属巧合，切勿模仿。","娱乐,明星",娱乐：觉醒曹贼系统，杨蜜嗨了,字数：207万
往事成空,https://b.faloo.com/1468905.html,28533,http://img.faloo.com/Novel/332x470/1/1572/001572008.jpg,full/001572008.jpg,月点击：772499,9.8,300,"【飞卢小说网独家签约小说：夏冬青和张楚岚是我同学】
林长青一觉醒来，发现自己穿越了。
他从一个三十岁的社畜，重新回到了大学时期。
虽然这个世界有些陌生，但能返老还童一波，林长青感觉也不是坏事，直到他发现自己的同班同学里，有两个眼熟的身影。
他们一个叫夏冬青，一个叫张楚岚。
这个世界看起来很平静，但似乎隐藏着不少危险。
还好，做为穿越者，总是有外挂的。
飞卢小说网提醒您：本小说及人物纯属虚构，如有雷同，纯属巧合，切勿模仿。","修真,捉鬼,影视",夏冬青和张楚岚是我同学,字数：55万
微笑天使笨萨摩,https://b.faloo.com/1474695.html,54930,http://img.faloo.com/Novel/332x470/1/1579/001579830.jpg,full/001579830.jpg,月点击：773627,9.3,6.3万,"【飞卢小说网独家签约小说：柯学：地下皇帝，开局ak扫鬼子】
吴狄重生90年代的柯学世界，觉醒宿慧，绑定‘地下皇帝’系统。
只要干违法的事情，就能获得奖励，事情闹得越大，奖励越丰富。
吴狄心一横，拿起新手礼包奖励的ak-47，在游乐园内大开杀戒。
重伤工藤新一，劫持毛利兰，截胡琴酒、伏特加……
劫富豪，灭社团，枪袭警视厅，炮轰黑衣组织……
从最恶悍匪，到东京第一社团，小日子最强社团BOSS，全球地下皇帝……
白天，各国正府说了算。
晚上，小丑皇说了算！
飞卢小说网提醒您：本小说及人物纯属虚构，如有雷同，纯属巧合，切勿模仿。","二次元,争霸,综漫",柯学：地下皇帝，开局ak扫鬼子,字数：34万
歌冰丽月,https://b.faloo.com/1472026.html,168503,http://img.faloo.com/Novel/332x470/1/1576/001576025.jpg,full/001576025.jpg,月点击：773660,9.4,5288,"【飞卢小说网独家签约小说：综漫：青眼幼龙，被骑士王捡到了】
【选项一：成为国王】
【选项二：成为轻小说男主】
【选项三：成为青眼白龙】
看着这三个选项，真正的穿越者根本不会有任何的犹豫。
这还用选吗？
当人的机会，哪辈子都有……但成为青眼白龙的机会，可能就是“此生仅有一次”了！
……
那天，跟着村民上山采石的阿尔托莉雅绝对不会想到。
她从山上抱下来的那块白色石头中，竟然孕育着一头蓝白色的幼龙。
“嗷呜——”
“好，好可爱。”
“我可以养它吗？”
……
PS：作者玻璃心警告。
飞卢小说网提醒您：本小说及人物纯属虚构，如有雷同，纯属巧合，切勿模仿。","综漫,龙",综漫：青眼幼龙，被骑士王捡到了,字数：48万
猛雪王,https://b.faloo.com/1371214.html,1434077,http://img.faloo.com/Novel/332x470/1/1582/001582354.jpg,full/001582354.jpg,月点击：773778,9.7,94.9万,"【飞卢小说网独家签约小说：让你普法，你给法官判十年？】
穿越律师获得系统，送人越多奖励越多。
于是叶秋开启狂徒之旅，超神战绩血洗律法界，轰动全网。
“学生助学金被贪，你把校方送进去？”
“保险公司拒保，反手上市公司告倒，清算整个行业？”
“上访者被判刑，你硬钢法院，当场送走检方和审判人员？”
“小仙女地铁诬陷偷拍，法官偏袒，你给审判长判无期，还把法院打解散了！”
“还代表中泱全面整顿公检法，参与国际法务纠纷，压得鹰酱欧酱抬不起头来！”
蓝星网友：卧槽，你大夏管这叫律师？
大夏网友：是的，兄弟是的，我们大夏的律师就是这样子的。
再介绍一下，站在你面前的是：大夏律政狂徒·东半球庭审阎罗·大美丽卡法庭恶霸·蓝星普法律..
飞卢小说网提醒您：本小说及人物纯属虚构，如有雷同，纯属巧合，切勿模仿。","直播,都市,法外狂",让你普法，你给法官判十年？,字数：83万
热血教师,https://b.faloo.com/1446875.html,644552,http://img.faloo.com/Novel/332x470/1/1542/001542916.jpg,full/001542916.jpg,月点击：773969,9.8,3.3万,"【飞卢小说网独家签约小说：鼠在黄风岭，从掠夺词条开始崛起】
黄风王重生在黄风岭当鼠妖，获得词条系统，掠夺、升级词条就能不断变强。
【射艺专精（白），升级射道之神（金）】
【会心一击（白），升级万倍暴击（金）】
【百丈穿杨（蓝），升级三界六道锁（金）】
孙悟空大闹天宫，无妖帮忙？黄风王大喊：“猴哥，我来助你！”
镇元子：“黄风岭,八百里,全是耗子架大狙。”
如来：“关外本是富饶地,一朝平地鼠患起！”
嫦娥：“只要有这裤腰带在，他就跑不了！”
天庭讨伐？黄风岭鼠王架起大狙，什么如来、玉帝，三清四御，皆在射程的真理之内。
玉帝：“什么，夭寿了，那耗子要搞新天庭！”
飞卢小说网提醒您：本小说及人物纯属虚构，如有雷同，纯属巧合，切勿模仿。","升级练,西游,洪荒",鼠在黄风岭，从掠夺词条开始崛起,字数：144万
不准叫孙上香,https://b.faloo.com/1475862.html,64248,http://img.faloo.com/Novel/332x470/1/1582/001582085.jpg,full/001582085.jpg,月点击：774657,9.7,7752,"【飞卢小说网独家签约小说：人在综漫写日记，女主太多了】
李泽穿越综漫世界七坤年，都财富自由了日记本才来。
“只要日记内容能让人相信，就能不断获得奖励？”
“还能穿越其他世界？”
【没想到苍天对我如此眷顾，竟然给了我一次重生的机会。】
于是乎，女主们都乱套了。
千早爱音：“anon酱怎么胸部平平的.jpg，哪个黑子p的图？说话！”
加藤惠：“这一次一定听我的劝告？可是我真不会读心术啊。”
桐须真冬：“冲师逆徒！芙莉莲、南宫那月……你到底有几个老师？”
赫斯缇亚：“他有一百个老婆，我得吃多少醋啊？”
天童木更：“李泽帮我报仇，我以身相许，很合理啊。”
飞卢小说网提醒您：本小说及人物纯属虚构，如有雷同，纯属巧合，切勿模仿。","二次元,综漫",人在综漫写日记，女主太多了,字数：33万
这西瓜包熟,https://b.faloo.com/1320147.html,1412035,http://img.faloo.com/Novel/332x470/1/1089/001089430.jpg,full/001089430.jpg,月点击：753901,9.8,47.3万,"【飞卢小说网独家签约小说：大秦：开局发老婆？夫人竟是惊鲵】
别人穿越到大秦要么是祖龙之子，要么是王侯公子。
可李默穿越过来却成了一个连老婆都娶不上的瞎子，开局就是天崩！
不过幸好，上天给他关起一扇窗，却帮他把房顶给掀了：觉醒修炼简化天赋和天眼。
获得内力：呼吸！
增强根骨：睡觉！
五雷天心掌：摩擦起电！
以心观世界，凌驾众生！
开局直接白捡一大美人当老婆！
却没想到居然娶了条娃娃鱼，一打井就咕噜咕噜。
祖龙求兵法？《抡语》了解一下？
干仗兵力不够？一硫二硝三木炭,加点白糖大伊万了解一下？
八岁的晓梦来拜师？养成了解一下？
你说我是瞎子？
你见过月神捏肩东君按腿焰灵姬喂进口飞卢的瞎子吗？
飞卢小说网提醒您：本小说及人物纯属虚构，如有雷同，纯属巧合，切勿模仿。","爽文,同人,后宫",大秦：开局发老婆？夫人竟是惊鲵,字数：332万
落河,https://b.faloo.com/1470688.html,46475,http://img.faloo.com/Novel/332x470/1/1573/001573912.jpg,full/001573912.jpg,月点击：754048,9.1,3752,"【飞卢小说网独家签约小说：综漫：从对魔忍到弑神者】
穿越综漫，林洛觉醒前记忆。
好消息：在觉醒了前世记忆的同时还得到穿越者必备的系统。
坏消息：这个世界有些危险，天使、恶魔、龙、怨灵、妖怪各种牛鬼蛇神纵横。
除此之外自己还是对魔忍的一员。
不管是为了自身安全也好，为了不让自己头顶青青草原也罢。
林洛只能成为世界最强！
.....
阿莎姬：只有林洛才是对魔忍的未来。
托尔：能帮我把背后的剑拔掉吗？
莉雅丝：有成为魔王的想法吗？林洛？我可以当你的王妃。
......
林洛：相信我最开始我只是不想戴帽子！
飞卢小说网提醒您：本小说及人物纯属虚构，如有雷同，纯属巧合，切勿模仿。","综漫,轻小说,假面骑",综漫：从对魔忍到弑神者,字数：54万
一生要强的波爷,https://b.faloo.com/1475678.html,2609,http://img.faloo.com/Novel/332x470/1/1581/001581680.jpg,full/001581680.jpg,月点击：754084,8.8,100,"【飞卢小说网独家签约小说：家父赵立春：军火大亨带飞汉东！】
重生赵瑞明，我的父亲是汉东省一把手赵立春。
出国五年，我混成了军火大亨。
那年，华夏改革开放有序推进，一切为经济建设让路，无数军工项目纷纷下马，造火箭不如卖茶叶蛋。
那年，鹰酱和毛熊带着小弟在国际上龙争虎斗，却不知几年后，毛熊将会分崩离析，华夏压力直接拉满，武器用时方恨少！
赵瑞明：汉东省要坚持半军半民军民融合，在军事上以顾客为上帝，在民用上坚守军工品质。
赵立春：我赞同
赵瑞龙：我赞同我哥！
祁同伟：我赞同赵公子！
侯亮平：求求你们，把枪放下，我赞同赵公子！
“内螺纹钢管？易燃易爆煤气罐？旋翼三蹦子？多管消防火箭炮？皮卡大口径催雨高炮？履带式拖拉机？巡航自毁航模？”
“你管这叫民用产品？兔子，你不讲武德！”
飞卢小说网提醒您：本小说及人物纯属虚构，如有雷同，纯属巧合，切勿模仿。","重生,都市,斗争",家父赵立春：军火大亨带飞汉东！,字数：28万
陈少,https://b.faloo.com/1427610.html,179181,http://img.faloo.com/Novel/332x470/1/1365/001365137.jpg,full/001365137.jpg,月点击：755105,9.5,9640,"【飞卢小说网独家签约小说：岳不群：都修仙了，还当什么盟主】
养吾剑法，养着养着，养出了浩然剑意。
紫霞神功，悟着悟着，悟出了呼云唤雨术。
甚至连小时候玩的弹弹珠，弹着弹着，弹成了天下溪神指。
若是这样也就罢了，岳不群看着越成熟越粘人的宁中则，跟婠婠如同姐妹的祝玉妍，一心只想给自己生孩子的林诗音……
岳不群陷入了沉思。
他以前嫉恨曹贼，结果现在自己成了曹贼。
飞卢小说网提醒您：本小说及人物纯属虚构，如有雷同，纯属巧合，切勿模仿。","爽文,同人,无系统",岳不群：都修仙了，还当什么盟主,字数：228万
裴剑仙,https://b.faloo.com/1428958.html,431490,http://img.faloo.com/Novel/332x470/1/1365/001365853.jpg,full/001365853.jpg,月点击：755460,9.9,12.4万,"【飞卢小说网独家签约小说：足球：神级中场！皇马巴萨馋哭了】
苏临风穿越了！
这一世他成为了双国籍华裔小将，开局因不满足协黑暗，暴揍国青领队而被国足封杀！
回到西班牙，又被巴萨无情抛弃，侮辱甩卖！
灰暗时刻！
苏临风系统加身！“上帝视角”开启！
满级视野！满级传球！中场大师巅峰模块！
还有数不清的超级巨星模板！
让他一跃成为足坛史无前例的神级中场！！
齐达内汗颜，皮尔洛自愧不如，哈维直呼“既生维，何生苏”！
苏临风开始屠戮欧洲足坛，所到之处寸草不生！
金童奖，金球奖，助攻王，金靴，欧洲杯，世界杯...
苏临风全都要！
梅西：如果苏愿意回到巴萨...我会主动让出10号球衣
c罗：我在苏面前，永远是小小罗！
穆里尼奥：毫无疑问，苏是历史最强10号！梅西？他比不上苏一根汗毛！
巴萨：当年是我有眼无珠，苏临风原谅我们吧...
飞卢小说网提醒您：本小说及人物纯属虚构，如有雷同，纯属巧合，切勿模仿。","爽文,热血,美女",足球：神级中场！皇马巴萨馋哭了,字数：191万
菜菜菜菜菜,https://b.faloo.com/1470551.html,12340,http://img.faloo.com/Novel/332x470/1/1573/001573825.jpg,full/001573825.jpg,月点击：755695,9.6,400,"【飞卢小说网独家签约小说：娱乐：一米小侏儒，强开杨蜜白露】
陈星穿越平行世界，变成了一个身高一米的小侏儒。
送外卖过程中遇上被下药的杨蜜，果断推倒并录像，反手敲诈两千万。
甚至还得到了播种系统。
只要在优质女人身上播种，就会得到不同程度的加强。
【在杨蜜身上获得身高种子，浇灌一次身高1，并获得满级导演能力。】
【浇灌张天艾成功，英俊1】
从此娱乐圈出现了一个天才侏儒导演，专门培养大长腿女明星。
杨蜜：谁说他不高？他高的地方你们不知道。
张天艾：人小鬼大的陈导经常指导我的演技。
白露：陈导的身高不高，但尺度够大啊。
热巴：谁说陈导矮？他在我心里像爸爸一样高大。
飞卢小说网提醒您：本小说及人物纯属虚构，如有雷同，纯属巧合，切勿模仿。","娱乐,明星,都市",娱乐：一米小侏儒，强开杨蜜白露,字数：57万
道号灵宝,https://b.faloo.com/1369377.html,111868,http://img.faloo.com/Novel/332x470/1/1070/001070667.jpg,full/001070667.jpg,月点击：755770,9.9,2.1万,"【飞卢小说网独家签约小说：玄幻：开局觉醒SSS级提取天赋】
穿越到玄幻世界的江枫，拥有SSS级提取与顿悟两种天赋，世间功法他一看就悟，神兵与宝物一摸就能随机提取！
随机提取绝世天骄，根骨800，武道资质提升！
随机提取古剑铁马冰河，获得玄冰剑意！
随机提取一页剑道残篇，获得天阶剑术！
随机提取太古帝剑，获得灭世剑域！
.......
他能提取一切！
包括提取万界仙佛与诸天神魔！
终有一日，江枫站在岁月长河之上，面对大道。
随机提取天地大道，获得大道法则！
从此，江枫开始了无限收割之路.....
飞卢小说网提醒您：本小说及人物纯属虚构，如有雷同，纯属巧合，切勿模仿。","爽文,美女,玄幻",玄幻：开局觉醒SSS级提取天赋,字数：564万
红莲,https://b.faloo.com/1460889.html,81315,http://img.faloo.com/Novel/332x470/1/1579/001579311.jpg,full/001579311.jpg,月点击：756272,9.4,1.2万,"【飞卢小说网独家签约小说：盘点三部曲，大帝寿命只有万年？】
江城穿越玄幻世界，加载视频网站，网站连接无数动漫世界。
视频网站内各个角色都在争论哪个世界最强，哪个世界至强者能力有多变态！
如欢愉星神笑声便可撕裂宇宙，湮灭一切的虚无星神！
此外还有龙珠至高神全王，一念抹除十二宇宙，亦有超级神龙一念间复原一切！
更有鹿目圆神、焰魔这等无限多元宇宙级，而这些存在都有令人羡慕的伟力，如复活、毁灭、永生不死等！
但随着江城的视频发布..
万界傻眼了，破坏神、众星神不敢置信，能压制他们的大帝，寿命居然只有一万年？
全王、大神官呆滞，你敢信多元级仙王，居然连过去未来都不敢轻易插足，更会因此被因果湮灭！
更让众至高想不到的是...
同为无限多元，仙帝也不敢干涉过去未来，而凌驾于众多至高之上的祭道之上，居然会得抑郁症？
这一刻，万界认知被颠覆了！
飞卢小说网提醒您：本小说及人物纯属虚构，如有雷同，纯属巧合，切勿模仿。","万界,盘点,曝光",盘点三部曲，大帝寿命只有万年？,字数：115万
