author,book_url,flowers,image_urls,images,monthly_clicks,rating,rewards,summary,tags,title,word_count
乱漫,https://b.faloo.com/1374607.html,4223687,http://img.faloo.com/Novel/332x470/1/1076/001076434.jpg,full/001076434.jpg,月点击：1130542,9.9,116.3万,"【飞卢小说网独家签约小说：综漫舰娘:从零开始打造次元帝国】
陆晨不慎穿越到毁灭后的蓝星，开局一个人，装备全靠捡。
所幸觉醒了次元文明系统，从石器时代开始征战万界，重建世界。
一个横跨次元的超级帝国出现在多元宇宙中。
舰娘海军陆战队听令，律者支援部队就绪，迦勒底英灵特遣队进入战斗位置。
魔法少女准备因果律打击，EVA已进入近地轨道，精灵们，换上神威灵装，碾碎敌人！！
万界的科技与魔法在此汇聚，打造出真正的地上天国。
我的文明横亘寰宇，超越次元。
纵然从零开始，我也将造我的城邦，在废墟之上。
飞卢小说网提醒您：本小说及人物纯属虚构，如有雷同，纯属巧合，切勿模仿。","爽文,穿越,系统",综漫舰娘:从零开始打造次元帝国,字数：332万
独居石,https://b.faloo.com/1473774.html,320080,http://img.faloo.com/Novel/332x470/1/1578/001578432.jpg,full/001578432.jpg,月点击：1138628,8.6,3万,"【飞卢小说网独家签约小说：木叶：我有一个重力修炼室】
夏木来到了火影世界，选择放下救世情节，尊重救世主命运，只为自己而活。
鸣人：萨斯给！
佐助：哪撸多！
小樱：你们住手！不要再打了！
雨一直下，雨下得很大，夏木在一旁嗑瓜子，顺便给女朋友天天也分一把。
佩恩：他把我的神罗天征弹开了！
带土：我只想要创造一个有琳的世界，夏木这混蛋却说有琳必有卡卡西，让我看卡卡西麒麟，出生啊！
六道斑：我愿称夏木为最强！
黑绝：夏木你混蛋，别踩我妈的脑袋！
夏木：不过是八门遁甲飞雷神仙人模式而已，竟然就是忍界最强了？
飞卢小说网提醒您：本小说及人物纯属虚构，如有雷同，纯属巧合，切勿模仿。","二次元,忍界,火影",木叶：我有一个重力修炼室,字数：100万
慢途的猪,https://b.faloo.com/1216400.html,11025511,http://img.faloo.com/Novel/332x470/1/1029/001029551.jpg,full/001029551.jpg,月点击：1710227,10,923.5万,"【飞卢小说网独家签约小说：全民转职：死灵法师！我即是天灾】
游戏降临现实，世界规则颠覆，人类进入全民转职时代。
魔物肆虐！秘境、副本、深渊数不胜数！
恐怖与宝物共存！危险与机遇同行！
唯有成为转职者！升级变强！方能站上世界之巅！
转职当天，林默语成为唯一性隐藏职业，死灵法师。
获得神级天赋，仅1级天赋就令所有技能增强10倍。
获得神级被动技能，所有伤害转移至召唤物身上。
从此召唤物不死绝，林默语便不会死。
“无穷无尽的神级骷髅战士！”
“亿万巫妖法师！”
“无数不死骨龙！”
“你扛得住吗？”
诅咒之下，神灵化为白骨。
尸体爆裂，天倾地覆，世界崩塌。
“我高坐骸骨神座，行走生死之间。”
“我即是天灾！”
飞卢小说网提醒您：本小说及人物纯属虚构，如有雷同，纯属巧合，切勿模仿。","爽文,穿越,系统",全民转职：死灵法师！我即是天灾,字数：953万
半块香橙,https://b.faloo.com/1470841.html,303774,http://img.faloo.com/Novel/332x470/1/1574/001574051.jpg,full/001574051.jpg,月点击：949229,9.4,9.5万,"【飞卢小说网独家签约小说：航海：开局掠夺克比词条！】
路恩穿越海贼世界，获得最强词条系统，可掠夺他人词条。
看着逃兵王克比身上那泛着金光的词条，路恩表示，你个小丑也配？拿来吧你！
随后，更多的强大词条，被路恩所掠夺。
海军本部：“他是能够吞噬一切，夺走一切的怪物，史上最凶恶的能力者，
没有世界政府最高层的许可，不许与之交战！
世界最危险的男人！‘天王’，路恩！
生死不论！悬赏金：39亿8890万贝利！”
飞卢小说网提醒您：本小说及人物纯属虚构，如有雷同，纯属巧合，切勿模仿。","二次元,航海,海贼王",航海：开局掠夺克比词条！,字数：57万
夜半三更,https://b.faloo.com/1467009.html,299883,http://img.faloo.com/Novel/332x470/1/1569/001569082.jpg,full/001569082.jpg,月点击：991726,9.5,3.3万,"【飞卢小说网独家签约小说：黑篮里的人气角色】
穿越了，没错，又来到了熟悉的黑篮世界。
本着辛苦打球不如买几手当老板看别人打球的想法，天道景严直接拒绝了他的破系统。
当然，世事无绝对，只要好处够多，没有事儿是没得谈的。
就这样天道景严带着他的统子踏上了他成为人气王的道路。
天道景严，“先给自己定格小目标，把《黑子的篮球》给打成《天道的篮球》！”
飞卢小说网提醒您：本小说及人物纯属虚构，如有雷同，纯属巧合，切勿模仿。","重生,搞笑,二次元",黑篮里的人气角色,字数：63万
机械之主,https://b.faloo.com/969757.html,9838994,http://img.faloo.com/Novel/332x470/0/980/000980005.jpg,full/000980005.jpg,月点击：998222,10,88.8万,"【飞卢小说网独家签约小说：全民领主：从零开始打造不朽仙域】
人人可成仙，人人可成神！
这是一个全民领主时代，也是有仙神同行，神话不仅仅是故事的时代！
吴池穿越平行世界，一脚迈入了这个诸天争渡，万族喋血的激昂大世！
拥有神秘至宝在手，他可以将一切领地建筑变异！
“白色”领主之心→“金色”领主之心！传说特性，登天门开！
【耕田】→【灵田】：产量x1000%！生长速度x1000%！
【水井】→【月亮之井】：瞬间回血！瞬间回蓝！
【箭塔】→【元素塔】：魔法齐鸣，毁天灭地！
【兵营】→【修仙学院】：三千剑仙，何惧一战！
......
吴池：“财富，权力，力量，美人......我，全都要！”
（ps：新书启程，质量保证，更新保证，内容比简介有趣，求收藏支持！）
。
飞卢小说网提醒您：本小说及人物纯属虚构，如有雷同，纯属巧合，切勿模仿。","爽文,热血,后宫",全民领主：从零开始打造不朽仙域,字数：901万
回不去的盛夏,https://b.faloo.com/1474607.html,11801,http://img.faloo.com/Novel/332x470/1/1584/001584937.jpg,full/001584937.jpg,月点击：998474,9.0,400,"【飞卢小说网独家签约小说：盘点崩坏超模怪，开局终焉灭世！】
罗峰穿越崩坏3rd世界，眼看着随时都有变成死士的危险的时候。
直播曝光系统降临！
当直播的画面降临到每个崩坏角色的面前。
整个崩坏宇宙画风出现了巨大的变化。
琪亚娜：“所以在每个世界里，我都是终焉之律者？”
芽衣：“在其他世界里，我和琪亚娜也都在贴贴？”
奥托：“我也是超模怪的一员吗？”
爱莉希雅：“魅魔凯文才是真正的超模怪！”
阿哈：“阿哈也是超模怪！”
......
随着一个个视频的播放......
崩坏宇宙的画风越来越不对劲了......
飞卢小说网提醒您：本小说及人物纯属虚构，如有雷同，纯属巧合，切勿模仿。","直播,无限流,盘点",盘点崩坏超模怪，开局终焉灭世！,字数：91万
顾止,https://b.faloo.com/1396616.html,1250018,http://img.faloo.com/Novel/332x470/1/1101/001101694.jpg,full/001101694.jpg,月点击：1011838,9.9,5.3万,"【飞卢小说网独家签约小说：大秦：儿子对比，嬴政酸了】
秦王政二十六年，天下刚刚一统，平行世界对比天幕降临，展现两个扶苏截然不同的一生。
嬴政看着天幕上那个功绩远迈自己，得千秋传唱、万代铭记，被赞誉为万古一太宗的扶苏。
又看了一眼身边这个因伪诏而死的公子扶苏，开始思考起能不能沟通天幕给他换一个儿子。
李斯看着左边天幕上被未来自己矫诏搞死的公子扶苏，以及自己被腰斩，夷灭三族的结局。
又看向右边天幕上那个尊称自己为斯相，在自己善终之后，还亲自追尊自己为“千古一相”的太宗扶苏。
心中同样浮现出一个想法，那就是能不能让他去辅佐太宗扶苏这样的秦二世？
吕雉、韩信、彭越等人看着让自己一展所长，善始善终，载誉青史的太宗扶苏。
心中也是同一个想法，他们也想追随那样的太宗扶苏陛下。
唯有公子扶苏、刘邦二人怀疑自我：“难道我做的真的那么差？”
飞卢小说网提醒您：本小说及人物纯属虚构，如有雷同，纯属巧合，切勿模仿。","爽文,种田,大秦",大秦：儿子对比，嬴政酸了,字数：204万
孙家小长工,https://b.faloo.com/1468695.html,30934,http://img.faloo.com/Novel/332x470/1/1571/001571399.jpg,full/001571399.jpg,月点击：1012355,9.4,888,"【飞卢小说网独家签约小说：黑料视频通过去，明星集体破防！】
穿越而来，林晨发现一款“超时空短视频”APP。
只要刷视频，就可以获得源源不断的奖励！
而他不知道的是，他刷的这些视频，都能够通过巨大天幕，让各个时空的人们看到！
林晨开局就刷到了【杨蜜：我老公呢！】
这香艳的画面，震撼到了所有人！
杨蜜：这视频中的女人，是我？
刘凯微：我怎么感觉脑袋绿绿的！
魏大熏：蜜姐私底下玩儿这么花，那我也有机会啊！
刷【明星出轨黑料！】
李晓璐：我会出轨？
贾乃量：你不是说去做头发了吗？
皮几万：嘿嘿，还是嫂子好玩儿！
杨影：我也离婚了？
丫丫：男人没一个好东西！
刷【哪吒2冲击全球票房！】
“阿凡达算个屁！”
“小哪吒给爷冲，要冲击全球票房冠军！”
刷【南天门计划！】
各国网友瑟瑟发抖！
龙国网友惊觉：原来列强竟是我自己！
飞卢小说网提醒您：本小说及人物纯属虚构，如有雷同，纯属巧合，切勿模仿。","重生,搞笑,成长",黑料视频通过去，明星集体破防！,字数：74万
今天更新了没,https://b.faloo.com/1468208.html,51866,http://img.faloo.com/Novel/332x470/1/1570/001570628.jpg,full/001570628.jpg,月点击：1032328,9.6,500,"【飞卢小说网独家签约小说：视频通过去：百亿哪吒娱乐圈破防】
江明绑定了系统，刷短视频吃瓜，就能赚钱！
越刷钱越多！
就在这时，江明刷的短视频分享到了每个时空节点！
刷【魔童哪吒2破百亿！】
整个娱乐圈破大防！
“什么，动画片也能百亿？”
“电影丸辣，我们真人流量干不过一个三岁小孩？”
“吒儿，给我破，干死全球榜！”
刷【娱乐圈三大定律】
汪风：好好好，这样玩是吧！
萧敬藤：气象局找我入职？
张學友：催我开演唱会，甲方是帽子蜀黍？
【刷明星们的“业余兼职”】
陈冠唏：摄影找我，技术贼高！
谢庭峰：你等着，我弄死你！
随着江明一条条短视频刷出！
偷税漏税、阴阳合同、出轨，逆天发言，抽象粉丝……
娱乐圈的腌臜事儿全部被曝光！
龙哥家开始了一场对于娱乐圈的大扫除！
“内鱼，丸辣！”
飞卢小说网提醒您：本小说及人物纯属虚构，如有雷同，纯属巧合，切勿模仿。",位面,视频通过去：百亿哪吒娱乐圈破防,字数：69万
肥牛泡面,https://b.faloo.com/1463239.html,1273308,http://img.faloo.com/Novel/332x470/1/1564/001564364.jpg,full/001564364.jpg,月点击：1036041,9.4,8.6万,"【飞卢小说网独家签约小说：综漫：从零开始打造恶魔眷族】
林恩穿越综漫世界，转生成为一只混血恶魔。
好在觉醒系统，能够招收属于自己的恶魔眷族。
不仅能够将眷族转生为特殊恶魔，还会赋予其类似于地错恩惠的升级体系。
于是……
‘书记恶魔’霞之丘诗羽：我已经理解了一切！
‘通灵恶魔’四谷见子：恶灵退散！
‘刀之恶魔’毒岛冴子：唯有杀戮，最令人愉悦！
‘食之恶魔’薙切绘里奈：神之舌，让我看看你的极限！
除此之外，林恩还有能够跨越世界的‘恶魔契约’。
飞卢小说网提醒您：本小说及人物纯属虚构，如有雷同，纯属巧合，切勿模仿。","二次元,综漫,万界",综漫：从零开始打造恶魔眷族,字数：81万
妖神级皮卡丘,https://b.faloo.com/1236995.html,7643030,http://img.faloo.com/Novel/332x470/1/1080/001080654.jpg,full/001080654.jpg,月点击：1059425,10,39.3万,"【飞卢小说网独家签约小说：综漫：从零开始组建神群】
穿越综漫世界，罗枢获得了神**再造系统，走上成为无上神王之路。
只是...
创建神**，成为神王的第一步是招收自己的眷族也就算了，可眷族指定番剧女主角是什么情况？
为什么这个世界的女主角大多是日常番女主角？还有，年轻的米拉小姐是什么鬼？走错片场了吧？
系统你要我造的这个神**，铁定有大问题吧？
还有那所谓的深渊入侵，这又是什么鬼啊？
面对生活的无奈，罗枢只能带着霞之丘诗羽、泽村英梨梨、锦木千束、梗小姐尝试一下，能不能在这个世界组建神**，创造新的神话。
所以，目标就先从成为潜伏在官方秘密部门的神秘组织领袖开始...
飞卢小说网提醒您：本小说及人物纯属虚构，如有雷同，纯属巧合，切勿模仿。","爽文,穿越,系统",综漫：从零开始组建神群,字数：522万
火影魔禁之王,https://b.faloo.com/1466620.html,398863,http://img.faloo.com/Novel/332x470/1/1568/001568539.jpg,full/001568539.jpg,月点击：1068178,9.7,4万,"【飞卢小说网独家签约小说：卖百吨黄金，从壁咚天仙妈开始】
重生2000年，林峰得到了一艘残破的外星综合舰。
从此，他开始了肆意妄为的人生。
百亿卖黄金，入股“美股四剑客”谷歌，网飞，亚马逊，脸书
在丑国先壁咚了天仙妈，然后让天仙认干爹。
回国创建内娱最大的娱乐公司。
“仙剑四美”为他吹拉弹唱。
诗诗弹琴，蜜蜜吹箫，嫣嫣鸣笛，天仙跳舞。
演过四大名著的姐姐捶背。
号称娱乐圈双冰的“豪门”捶腿。
林峰：“生活不需要太繁琐，这样简单就好！”
只是回过神来，他发现自己不但养活了整个娱乐圈而且让整个龙国的崛起于世界巅峰。
丑国：“上帝啊，今年全球矿石，石油暴涨，求出口！”
袋鼠国：“为什么我们袋鼠国没有了矿产，只有袋鼠了！”
膏药：“今年的铁矿石协议能不能商量一下！”
在国内，企鹅，阿里，美团瑟瑟发抖，组建了防抗了联盟。
飞卢小说网提醒您：本小说及人物纯属虚构，如有雷同，纯属巧合，切勿模仿。","重生,娱乐,明星",卖百吨黄金，从壁咚天仙妈开始,字数：144万
重生的君麻吕,https://b.faloo.com/1412043.html,733488,http://img.faloo.com/Novel/332x470/1/1118/001118574.jpg,full/001118574.jpg,月点击：1090287,9.8,4.4万,"【飞卢小说网独家签约小说：星穹铁道：我在仙舟开发手游】
林语穿越到了星铁的世界。
他获得了神级手游打造系统，第一部开发的手游便是《崩坏：星穹铁道》。
很快，他的游戏便引发了全宇宙的关注。
当玩家进度来到可可利亚boss战。
《野火wildfire》响起。
“我靠？你是个回合制游戏啊，怎么敢搞得这么燃的！”
“音乐响起的刹那，我以为我要干星神了！”
进度来到丹恒开海。
“我以为野火已经够燃了，没想到还有高手！”
“丹恒你还说你不是饮月君？都成五星限定了！”
来到匹诺康尼。
“什么？你染上不眠之夜了？”
“黄泉强度已测，家人们放心抽！”
“冥火大公：孩子们，这并不好笑。”
“过剧情之前：砂金？不就是个唯利是图的骗子么！过剧情后：愿母神三度为你阖眼……”
“什么砂金！那明明是我命途多舛的好兄弟！”
飞卢小说网提醒您：本小说及人物纯属虚构，如有雷同，纯属巧合，切勿模仿。","爽文,系统,直播",星穹铁道：我在仙舟开发手游,字数：180万
人间重炮,https://b.faloo.com/1470919.html,49120,http://img.faloo.com/Novel/332x470/1/1574/001574134.jpg,full/001574134.jpg,月点击：1123240,9.1,6964,"【飞卢小说网独家签约小说：万亿家产后才知，我岳父是赵立春】
重生五年，有一个相濡以沫的女友。
林羽感觉自己的人生很完美。
靠着系统和重生的先知先觉，林羽很快就积攒了万亿家产。
这个时候，女朋友告诉我，她的爸爸是赵立春。
赵立春？
汉东省的赵立春？
我都万亿家产了，你告诉我岳父是赵立春？
赵立春：贤婿，有了你，我咋感觉我进步的有点快呢？
赵瑞龙：姐夫，姐夫，你好好调教我，我跟你混。
祁同伟：林总，你对我恩同再造，我这条命就是你的了。
侯亮平：调查林羽，我他妈的敢调查？华夏的经济不发展了？
飞卢小说网提醒您：本小说及人物纯属虚构，如有雷同，纯属巧合，切勿模仿。","重生,都市,金钱",万亿家产后才知，我岳父是赵立春,字数：119万
雷人大王,https://b.faloo.com/1471945.html,64904,http://img.faloo.com/Novel/332x470/1/1575/001575889.jpg,full/001575889.jpg,月点击：897193,9.6,1300,"【飞卢小说网独家签约小说：舅舅祁厅，娱乐帝国，野狗看门】
郁江穿越名义，成为祁同伟的亲外甥。
携带概念神技“更上一层楼”，横扫整个娱乐圈。
什么？票房只有十个亿？看我更上一层楼，拿下，票房二十亿！
什么？国际电影节只能拿银奖？看我更上一层楼，拿下，金奖！
什么？杨密你要和我结婚？看我更上一层楼，拿下，哈？你让我给你多找几个姐妹？
亮平：你好歹毒，把我扁去乡下司法所就算了，你竟怂恿你舅占我的屋，打我的娃，还撞...
沙瑞金：我好好的汉东一把手没了？改高育良了？
高育良：小江是汉大帮的福星。
赵瑞龙：汉东不允许有这么牛逼的人，除非愿意带我玩。
祁同伟：我进部了，村里野*都被我外甥安排看大门，你儿子改名祁浩然，身为钟家新女婿，我已经胜天半子。
飞卢小说网提醒您：本小说及人物纯属虚构，如有雷同，纯属巧合，切勿模仿。","娱乐,杨老板,侯亮平",舅舅祁厅，娱乐帝国，野狗看门,字数：70万
僵尸在洪荒超神,https://b.faloo.com/1473376.html,99428,http://img.faloo.com/Novel/332x470/1/1583/001583528.jpg,full/001583528.jpg,月点击：894219,9.6,1688,"【飞卢小说网独家签约小说：洪荒：我苍天霸体，开局拜师黄龙】
陈玄穿越北斗，成为叶凡同学，意外觉醒苍天霸体。
本想着和叶天帝打好关系，最后一起飞升仙域。
却不想竟可自由穿梭洪荒世界。
洪荒寻机缘，北斗习秘术，这下陈玄起飞了。
女娲：“吾有一子，当有圣人之资！”
通天：“陈玄若愿入截教，可为吾教副教主！”
元始：“笑话，吾徒孙当有圣人之资，截教也配？！”
西方二圣：“此子与我西方有缘！”
安澜：“仙之巅，傲世间，有那陈玄便有天！”
帝骨哥：“陈玄这么变态的嘛！！！”
诡异始祖：“完了，惹了这个煞星，没得玩了！”
....
在北斗，陈玄打破一世无二帝的诅咒，成功证道。
叶玄二帝之名威震寰宇，举世无双。
叶凡：虽然我已成为了天帝，但不知道为什么，我总觉得自己活在陈玄影子里。
飞卢小说网提醒您：本小说及人物纯属虚构，如有雷同，纯属巧合，切勿模仿。","重生,升级练,扮猪吃",洪荒：我苍天霸体，开局拜师黄龙,字数：62万
地下道大主管,https://b.faloo.com/1279070.html,4268241,http://img.faloo.com/Novel/332x470/0/974/000974707.jpg,full/000974707.jpg,月点击：895025,10,19.7万,"【飞卢小说网独家签约小说：原神：邀请纳西妲，MC造净善宫】
穿越提瓦特的江玄，开启了通往我的世界的双穿门。
不仅可以带人一起去MC，还能激活各种MOD？
纳西妲：要想富，先撸树！挖三填一下矿洞！
胡桃：那边的猪人族，要不要试试这幅新棺材？纯黑曜石打造，买的舒心，死的放心哟！
温迪：诶嘿！特瓦林别找我了，我怕末影龙误会！
神子：八重堂批量出售拔刀剑啦！一刀999，御前决斗必备良刀啦！
钟离：以普遍理性而言，这名为巴雷特的枪，似乎比贯虹之槊更好用一些。
……
经年之后，沉睡的天理苏醒。
望着眼前翻天覆地的提瓦特，缓缓扣出一个问号。
“前面的天理，你涉嫌城市中无证飞行，将被提瓦特第七十三治安局羁押并提起诉讼。”
“你有权保持沉默，若予以武力抗争，我方不排除出动泰坦铁傀儡与空天航母战列编队。”
“另外……”
“大人，时代变了！”
飞卢小说网提醒您：本小说及人物纯属虚构，如有雷同，纯属巧合，切勿模仿。","爽文,后宫,原神",原神：邀请纳西妲，MC造净善宫,字数：610万
哪哪哪,https://b.faloo.com/1473261.html,77917,http://img.faloo.com/Novel/332x470/1/1577/001577818.jpg,full/001577818.jpg,月点击：897193,9.6,100,"【飞卢小说网独家签约小说：大庆：陈萍萍养子，生母叶轻眉】
陈青峰穿越庆余年，成为叶轻眉亲子，范闲双胞胎，开局面临生死危机。
幸而觉醒签到系统，只需按部就班签到，就能获得奖励，发育升级。
出生后，三条金龙护体，保住性命，却亲眼看着母亲，自刎眼前！
陈萍萍血洗京都，收养陈青峰，人在鉴查院，习武者之道，修永生之法。
签到一年，奖励悟性逆天！
签到范若若，奖励永生法！圣灵丹！
签到范闲，奖励天机术法！长生经文！
青梅范若若，林婉儿，司理理，桑文，海棠朵朵......醒掌天下权，醉卧美人膝！
若干年后，范闲兄弟相认，逼宫庆帝，整个大庆风云变幻！
陈青峰站在风暴中心，一剑递出，宗师陨落，庆帝色变！
飞卢小说网提醒您：本小说及人物纯属虚构，如有雷同，纯属巧合，切勿模仿。","升级练,复仇,影视",大庆：陈萍萍养子，生母叶轻眉,字数：72万
司徒清风,https://b.faloo.com/1474141.html,82716,http://img.faloo.com/Novel/332x470/1/1585/001585345.jpg,full/001585345.jpg,月点击：898993,9.5,2.3万,"【飞卢小说网独家签约小说：综漫：掠夺词条，开局主从契约】
林渊穿越综漫世界，觉醒系统，掠夺词条，成为勇者与恶魔的混血。
多年后觉醒恶魔血脉，被赶出勇者村落，流浪至人杰地灵的驹王镇。
开局杀死兵藤一诚，掠夺赤龙帝的笼手，收能干的妹妹，得主从契约魔法。
开启穿界门，穿梭万界。
雷娜蕾：“主人的一切就是我的一切~”
成濑澪：“变态哥哥，杀你一百次！”
四谷见子：“吃了这个，真的就能抵御咒灵吗？”
英梨梨：“为什么我妈妈也在这里呀！”
……
…
飞卢小说网提醒您：本小说及人物纯属虚构，如有雷同，纯属巧合，切勿模仿。","二次元,综漫,开局",综漫：掠夺词条，开局主从契约,字数：48万
创造天地,https://b.faloo.com/1444973.html,1155604,http://img.faloo.com/Novel/332x470/1/1540/001540682.jpg,full/001540682.jpg,月点击：902044,9.6,12.6万,"【飞卢小说网独家签约小说：特种兵：每周一个签到大礼包】
穿越融合世界，觉醒系统金手指。
开局实战二十杀，震惊整个战区。
龙小云：杀人后什么感觉？
林峰：当时很惊恐，尿不湿都尿湿了！
高大壮：卧槽，你还是人类吗？
何志军：你只管做事，黑锅老子替你背。
高世巍：挖我的墙角，军部也不行！
老美军方：我国承诺不使用核武器，贵国同样不能出动行走的核弹！
江山似娇，美人如画，权柄在握。
林峰动力无限，因为这个世界非常精彩...
飞卢小说网提醒您：本小说及人物纯属虚构，如有雷同，纯属巧合，切勿模仿。","影视,特种兵,校花",特种兵：每周一个签到大礼包,字数：179万
催眠X指导,https://b.faloo.com/1474258.html,77965,http://img.faloo.com/Novel/332x470/1/1582/001582399.jpg,full/001582399.jpg,月点击：905052,9.6,4464,"【飞卢小说网独家签约小说：双穿里番，掠夺催眠词条】
穿越到修仙世界，
觉醒词条系统，
开局获得【纯阳圣体（金）】却没想到被宗主顾清欢看中，被抓去当了炉鼎！
日日被采补。
忍受靠着积攒积分抽奖词条，获得【两界】词条，穿越两界，却发现来到了里啥世界。
开局掠夺【催眠】词条，催眠顾清欢一步步将宗门变成个人后宫。
有容乃大的师傅顾清欢、
清纯可人的师叔云沁月、
妩媚撩人的姨姨柳媚、
可爱羞涩的师妹苏念瑶、
……
而在里啥世界，爱莉、对魔忍、魔法少女、催眠性指导……
飞卢小说网提醒您：本小说及人物纯属虚构，如有雷同，纯属巧合，切勿模仿。",宗门,双穿里番，掠夺催眠词条,字数：50万
