author,book_url,flowers,image_urls,images,monthly_clicks,rating,rewards,summary,tags,title,word_count
最爱吃手办,https://b.faloo.com/1067217.html,576352,http://img.faloo.com/Novel/332x470/0/827/000827579.jpg,full/000827579.jpg,月点击：740098,10,6.6万,"【飞卢小说网独家签约小说：视频通万界:盘点十大救世主】
林尘穿越到异世界，在这被异兽威胁的世界，该怎么生存，这时觉醒了诸天视频系统，从此走上人生巅峰，成为异界最靓的仔。
no.10我要燃起来了！炎龙王纳兹
no.9樱花满地集于我心,蝶舞纷飞祈愿相随
no.8荣耀尽归鲁路修
no.7**了，鸣人重粒子模式
......
飞卢小说网提醒您：本小说及人物纯属虚构，如有雷同，纯属巧合，切勿模仿。","爽文,穿越,系统",视频通万界:盘点十大救世主,字数：386万
帅到惊动党,https://b.faloo.com/1321901.html,738183,http://img.faloo.com/Novel/332x470/1/1035/001035810.jpg,full/001035810.jpg,月点击：740160,9.8,24.1万,"【飞卢小说网独家签约小说：港岛，重生霍家，开局阻击索罗斯】
1997年，霍煊重生港岛，成为霍家长子霍振霆的三儿子霍启煊。
祖父是霍鹰东，港岛最著名的红色实业家，掌管庞大的家族企业，涉及多个领域。
父亲是霍振霆。港岛奥委会主席。
二叔是霍振桓。地产、能源、基建大亨。
三叔是霍振欧。酒店，娱乐产业大亨。
四叔霍振环，五叔霍振荣都是金融、科技圈的顶级投资大亨。
一家子红色企业家，虽身在港岛，却心在大陆。
这一年，港岛回归，金融风暴席卷亚洲，国际金融大鳄索罗斯等人开始收割亚洲各国，其中包括港岛。
然而，索罗斯等人不知道的是，在霍启煊的操作下，霍家赌上了一切，一张巨网缓缓张开，准备阻击索罗斯和华尔街。
最后，霍家赌赢了，成为..
飞卢小说网提醒您：本小说及人物纯属虚构，如有雷同，纯属巧合，切勿模仿。","爽文,穿越,科技",港岛，重生霍家，开局阻击索罗斯,字数：383万
笑恩的猪,https://b.faloo.com/1381055.html,36724,http://img.faloo.com/Novel/332x470/1/1560/001560369.jpg,full/001560369.jpg,月点击：740419,9.6,2300,"【飞卢小说网独家签约小说：我刷短视频，历史人物集体吐血！】
林铭激活了刷视频就有钱系统。
只要在手机上刷短视频，就有钱到账。
并且，他刷出来的短视频，被共享到各个位面。
刷【坦克300爆燃解说】
嬴政：额滴娘啊，这是钢铁猛兽吗！
刷【如何科学地弄死皇帝】
古代皇帝们吐血，怎么还教这些！？
刷【农村大席小王子18菜2汤】
古人麻了，老百姓吃的都比皇帝好！
刷【淞沪会战】【长津湖】
古代皇帝们惊呆了，这是…信仰的力量啊！
…
当林铭开启跨位面带货之后，
无人机、马克沁、对讲机……古人疯狂下单！
共同见证后世繁华！
飞卢小说网提醒您：本小说及人物纯属虚构，如有雷同，纯属巧合，切勿模仿。","爽文,系统,搞笑",我刷短视频，历史人物集体吐血！,字数：361万
卡文哥哥,https://b.faloo.com/1441525.html,274847,http://img.faloo.com/Novel/332x470/1/1570/001570124.jpg,full/001570124.jpg,月点击：740551,9.3,9.1万,"【飞卢小说网独家签约小说：综漫：开局樱花庄，捡到女高中生】
穿越了综漫日常的世界。
林熙丝毫不慌。
开局就有了一座樱花庄。
没错，就是因宠物女孩椎名真白这部番而出名的樱花庄！
收租就能持续躺平，简直不要太惬意。
还没等到椎名真白到来，就先在路边捡到了一个名为狄原沙优的JK。
把JK带回家拥抱后，居然激活了金手指的词条技能，金枪不倒！
这个世界，有霞之丘，有英梨梨，还有雪之下，有三色院堇子，四宫辉夜，高坂桐乃……
既然是综漫，出现更多的人也不奇怪。
但那位亚丝娜是认真的吗？虚拟现实游戏也可以玩了？
还有芙利莲，珈百璃？
偶遇还能看见被灵吓尿的四谷见子？
说好的日常呢？
后面甚至打工魔王的勇者小姐姐也过来了？
我樱花庄住不下这么多人了啊！
谁来帮我扩建一下越来越多妹子的樱花庄？在线等，急啊！
飞卢小说网提醒您：本小说及人物纯属虚构，如有雷同，纯属巧合，切勿模仿。","二次元,综漫,轻小说",综漫：开局樱花庄，捡到女高中生,字数：144万
金胸毛狮王谢逊,https://b.faloo.com/1415170.html,61768,http://img.faloo.com/Novel/332x470/1/1136/001136084.jpg,full/001136084.jpg,月点击：740603,9.8,3176,"【飞卢小说网独家签约小说：万古最强魔头，掠夺诸天我无敌】
苏铭穿越到三千大世界，成为无极魔域的魔帝子！
觉醒万古最强魔头系统，只要完成系统任务，便可获得各种太古至宝与神兵帝器，急速提升实力，掠夺诸天，横扫无敌！
叮！恭喜宿主成功征服女帝，奖励洪荒祖龙心头血！
叮！恭喜宿主成功掠夺太一圣地，奖励原始真解！
叮！恭喜宿主横扫北斗星域，奖励魔祖弑神枪！
数年后，苏铭成长为一尊旷古绝今的最强魔头！
问鼎武道之巅，镇压太古各路巨头！
抬手间神山与圣地倾覆，谈笑间诛佛斩神屠仙！
远古神兽为坐骑，魔尊重楼为仆，广寒仙子为婢女！
独领风骚，魔威镇万古，诸天星河，唯我独尊！
本书又名《这个二世祖有亿点强》《瑶池姑射嫦娥，三位仙子请留步》《方才...是谁在言无敌？》
飞卢小说网提醒您：本小说及人物纯属虚构，如有雷同，纯属巧合，切勿模仿。","爽文,系统,美女",万古最强魔头，掠夺诸天我无敌,字数：394万
归来直上天榜,https://b.faloo.com/1442346.html,52169,http://img.faloo.com/Novel/332x470/1/1585/001585289.jpg,full/001585289.jpg,月点击：741225,9.9,19.2万,"【飞卢小说网独家签约小说：我，祁同伟，满级词条主宰汉东！】
穿越平行世界，成为了胜天半子祁同伟。
更是绑定了词条系统，获得了无数满级词条！
【刻苦勤奋（青铜）——笃学不倦（至尊级）】
【记忆不凡（青铜）——过目不忘（至尊级）】
【吃苦耐劳（白银）——黄金大超体质（至尊级）】
【好大喜功（黑铁）——权势滔天（超至尊级）！】
.......
凭借着自身的能力，祁同伟只身捣毁贩毒组织，成就孤鹰领战神，立下滔天大功。
调入东山，参与破冰行动，捣毁塔寨。
京海行，扫黑除恶，摧毁强盛集团。
绿藤市，打黑打伞，镇杀高明远！......
这一桩桩一件件的功劳，让祁同伟的仕途越走越稳。
更是在一步步的升迁晋升中，赶走赵立春。
硬刚空降兵沙瑞金，直至主宰汉东！
飞卢小说网提醒您：本小说及人物纯属虚构，如有雷同，纯属巧合，切勿模仿。","都市,权谋,影视",我，祁同伟，满级词条主宰汉东！,字数：154万
飞天白鲸,https://b.faloo.com/1446978.html,95795,http://img.faloo.com/Novel/332x470/1/1543/001543665.jpg,full/001543665.jpg,月点击：741365,9.9,1500,"【飞卢小说网独家签约小说：影视：从顾佳翻白眼开始！】
许硕穿越到影视综合的平行世界，成为了城中之城远舟投资公司的投资副经理，并激活了影视图鉴收集系统。
只要完成图鉴目标的收集，就会获得相应奖励。
一时间，风韵妩媚的远舟老板娘沈婧，为老公寻求融资的顾佳，挽回别墅的蒋南孙、来远舟调查罪犯投资记录的钟小艾，美艳房东宋倩全都遭了殃……
沈婧：狗东西，老板娘也敢碰！
顾佳：小许，许幻山知道了咋办？
蒋南孙：你说的帮我保住别墅，就是让我给你做小？
钟小艾：小畜生，你这是犯罪，你完了！
宋倩：小许，英子可能知道了……
……
随着图鉴目标的不断登场，许硕愈发忙碌了……
不是在收集图鉴目标，就是在收集图鉴目标的路上……
飞卢小说网提醒您：本小说及人物纯属虚构，如有雷同，纯属巧合，切勿模仿。",暧昧,影视：从顾佳翻白眼开始！,字数：153万
原神美漫大秦,https://b.faloo.com/1475616.html,27045,http://img.faloo.com/Novel/332x470/1/1581/001581688.jpg,full/001581688.jpg,月点击：749411,9.8,200,"【飞卢小说网独家签约小说：铠甲：力捧美真，我帝皇正的发邪】
苏晨意外穿越铠甲世界，觉醒神级系统！
新手礼包一发入魂！
魅魔体质，女人见了恨不能倒贴，还觉得自己赚了！
五行血脉，可以召唤所有铠甲！
还是升级版！
此后，被女角色疯狂倒贴的苏晨，一路打怪升级，超越天道！
等暗影大帝降临！
苏晨化身天道帝皇，一招秒了！
....
美真：炘南，唔...你先别回实验室，我...我正健身呢！
敏慈：苏晨这样的绅士，对人家做什么都可以。
冰儿：以后别联系了，北淼，我怕苏晨误会！
慧姨：炘南，咱们以后各论各的，苏晨管你叫哥，你管苏晨叫姨夫！
炘南：？？？
飞卢小说网提醒您：本小说及人物纯属虚构，如有雷同，纯属巧合，切勿模仿。","重生,升级练,暧昧",铠甲：力捧美真，我帝皇正的发邪,字数：37万
莫名小许,https://b.faloo.com/1458360.html,174128,http://img.faloo.com/Novel/332x470/1/1563/001563965.jpg,full/001563965.jpg,月点击：750136,9.7,13.8万,"【飞卢小说网独家签约小说：抗战：过雪山草地后，我带回个军】
一朝穿越，苏华成为红军团长，手握原始股。
1935年，长征结束后，为避内部斗争影响，壮大革命队伍，大縂指挥授命苏华、李云龙、丁伟、孔捷，程瞎子5人各带一个团对外发展。
苏华绑定强军强国系统，在外建立根据地，招兵买马，网罗顺溜，李大本事…等英才，列装优良装备。
1937年，小鬼子全面入侵，大縂指挥召集全军归队。
丁伟：我红14团就3000多人，还有几门迫击炮…
孔捷：我红15团只有4000来人，装备只有轻重机枪…
程瞎子：我红16团只有3000人，汉阳造都还没列装完…
李云龙：我红17团人不多，也就万把人，装备马马虎虎，也就2门意大利炮，轻重机枪…
正当众人寒暄之时，骑兵营，炮兵营，特种部队……等组成的轻型合成师展露在众人面前。
苏华淡淡道：“我发展还行，也就5万余人…”
飞卢小说网提醒您：本小说及人物纯属虚构，如有雷同，纯属巧合，切勿模仿。","成长,争霸,铁血",抗战：过雪山草地后，我带回个军,字数：96万
摸鱼的小迪莫,https://b.faloo.com/1416189.html,41485,http://img.faloo.com/Novel/332x470/1/1131/001131190.jpg,full/001131190.jpg,月点击：750165,9.8,1188,"【飞卢小说网独家签约小说：原崩铁神剧情播放：开局匹诺康尼】
神剧情播放直播间降临崩铁宇宙以及提瓦特
开局就播放神剧情，匹诺康尼篇！
砂金：三枚筹码足以，所有，或一无所有！
流萤：我梦见一片焦土，一株破土而出的新蕊..飞萤扑火，向死而生！
黄泉：愿死亡结束你漫长的梦..引领你归还清醒的世界
米哈伊尔：行遍人生旅途的最后，我把这一点自视珍贵的火苗留在最深的梦里，希望交给后世的无名客们。
铁尔南：有些事即便没有意义，也总是要去做的。
直至最后，星期日登场！
“我将飞上高空，变作天上的太阳。”
“万众在我的光芒中热烈生长，而一切罪恶将无所遁形。”
“倘若你们的乐园能拯救更多的人，那就亲手为我断绝前路吧。”
第一日赐予真实
第二日赐予历法
第三日赐予言语
...
即将见证，太初有为！
飞卢小说网提醒您：本小说及人物纯属虚构，如有雷同，纯属巧合，切勿模仿。","二次元,网游,原神",原崩铁神剧情播放：开局匹诺康尼,字数：209万
梨花绘做衣,https://b.faloo.com/1471501.html,77081,http://img.faloo.com/Novel/332x470/1/1575/001575097.jpg,full/001575097.jpg,月点击：750543,9.6,1100,"【飞卢小说网独家签约小说：游戏王副本：开局一套电子龙】
一脚踏空，游阳穿越到到了一个决斗至上上的世界。
在这个世界中，会出现奇怪奇怪的卡牌副本！
打穿这些副本，将会获得各种稀有卡牌。
凭借着穿越时带着的卡组，以及自己的决斗知识。
游阳攻略了一个又一个副本，将里面的特殊卡牌纳入手中。
打穿白龙副本，获得【究极龙魔导师】和白龙全家桶！
打穿真红眼副本，获得奖励真红眼系列加【真红眼龙骑士】！
打穿星尘龙副本，获得奖励流天、耀变以及一整套废二！
有人问游阳，有没有连你也觉得棘手的副本？
如果副本是珠泪的话，可能会有点棘手。
会输吗？
游阳望着手中一套码丽丝加次元系卡牌。
自信的回答道：会赢哦！
飞卢小说网提醒您：本小说及人物纯属虚构，如有雷同，纯属巧合，切勿模仿。","网游,都市,游戏",游戏王副本：开局一套电子龙,字数：44万
天边的月亮,https://b.faloo.com/1452347.html,195277,http://img.faloo.com/Novel/332x470/1/1549/001549786.jpg,full/001549786.jpg,月点击：750885,9.4,15.7万,"【飞卢小说网独家签约小说：木叶：让你刷羁绊，你得罪全忍界】
穿越火影世界，玄月获得了‘羁绊系统’，只要建立羁绊就能获得奖励。
好消息，外挂到账了，坏消息，他这一世叫志村玄月，爷爷是志村团藏。
看着那一张纸装不下的仇人清单，志村玄月叹了口气。
忍界魅魔当不成了，只能选择另一条道路。
【成功与宇智波鼬建立宿敌羁绊，获得奖励‘宇智波血脉’】
【成功与三代火影建立死敌羁绊，获得奖励‘忍术博士’】
【成功与宇智波斑建立舞伴羁绊，获得奖励‘天碍震星’】
【成功与大筒木辉夜建立...】
........
第四次忍界大战期间，面对忍界联军，血月当空，纯白的卯之女神降世，志村玄月露出肆意张狂的笑容。
“辉夜，快过来加深一下羁绊！”
飞卢小说网提醒您：本小说及人物纯属虚构，如有雷同，纯属巧合，切勿模仿。","二次元,轻小说,火影",木叶：让你刷羁绊，你得罪全忍界,字数：95万
一个大树啊,https://b.faloo.com/1471889.html,27651,http://img.faloo.com/Novel/332x470/1/1575/001575805.jpg,full/001575805.jpg,月点击：750928,9.6,13.3万,"【飞卢小说网独家签约小说：曝光龙珠未来，监狱行星篇开始】
曝光不同龙珠世界的未来！
【第一个未来，龙珠超英雄篇。】
未来特南克斯消失，孙悟空和贝吉塔来到了监狱行星，这个未来竟然是次元乱斗？！
【第二个未来，龙珠gt】
超级赛亚人四，竟然是这样来的吗？
悟空先生，你竟然牺牲了自己，打败了超级一星龙？
【第三个未来，龙珠大魔】
变成小孩子？魔界的故事？这都什么和什么啊！
【第四个未来，龙珠AF】
不是，悟空先生，你的基因怎么又诞生了更强大的赛亚人战士？
第七宇宙是不是有些太强了！？
飞卢小说网提醒您：本小说及人物纯属虚构，如有雷同，纯属巧合，切勿模仿。","盘点,视频,龙珠",曝光龙珠未来，监狱行星篇开始,字数：66万
不得鸟归来,https://b.faloo.com/1461901.html,190716,http://img.faloo.com/Novel/332x470/1/1562/001562420.jpg,full/001562420.jpg,月点击：751108,9.9,9488,"【飞卢小说网独家签约小说：穿越影视之强娶大女主！】
魏廷瑜一觉醒来，发现自己穿越到了《九重紫》的世界，血肉顶替了大女主窦昭的负心前夫哥？
什么？这个世界居然还是《知否》、《墨雨云间》、《玉楼春》、《梦华录》、《花惜芷》等等多部大女主剧的综合世界？
当这些大女主一个个出现在魏廷瑜的身边的时候，他应该怎么办呢？
只要将这些眼高于顶的大女主纷纷变成自己身边的小女人，就能走上人生巅峰！
窦昭：“夫君！我知你为难，但我必须是正妻！”
盛明兰：“我是一心一意愿意跟你的，但绝对不做妾！”
薛芳菲：“夫君助我复仇，我愿以身相许！但唯有做妾这一条恕难从命！”
……
魏廷瑜：“这有何难？你们皆为平妻！”
众女懵逼：“这于礼..
飞卢小说网提醒您：本小说及人物纯属虚构，如有雷同，纯属巧合，切勿模仿。","影视,综武,商战",穿越影视之强娶大女主！,字数：109万
憧憬未来的小迪,https://b.faloo.com/1448713.html,232653,http://img.faloo.com/Novel/332x470/1/1545/001545289.jpg,full/001545289.jpg,月点击：752134,9.8,2.1万,"【飞卢小说网独家签约小说：骑士：无限召唤，从创世女神开始】
夏目穿越到假面骑士Geats的世界。
见证到世界恸哭悲鸣的夏目获得未知的Diend驱动器。
还有能够召唤历代所有骑士的人物驾驭卡片！
本源之力让夏目将历代所有骑士召唤莅临在各个骑士世界！
为此夏目要先将所谓的狐神，牛圣，景木研还有欲望大奖赛通通驱逐！
【失忆的进化人类-闪耀的光芒】
【破碎的虚无欲望-永恒结婚鸟】
【永远的小天使-镜中赤色之龙】
【最后的戒指-希望的红魔法师】
【不败的超越灵魂-无限之灵魂】
【行天之道总司一切-超越未来】
【守护蓝天之梦想-真红的血液】
【奇幻故事-全知全能的十圣刃】
【奇幻色彩的凯米-彩虹的创世】
茨姆莉（创世女神）..
飞卢小说网提醒您：本小说及人物纯属虚构，如有雷同，纯属巧合，切勿模仿。","召唤,无系统,变身",骑士：无限召唤，从创世女神开始,字数：201万
钟离天榜6,https://b.faloo.com/1473690.html,16930,http://img.faloo.com/Novel/332x470/1/1578/001578321.jpg,full/001578321.jpg,月点击：752305,9.1,100,"【飞卢小说网独家签约小说：人在超神，开局五阶基因锁被曝光】
穿越超神宇宙，楚浩开启无限流基因锁。
并且获得了盘点系统，可以通过盘点诸天一切，收割情绪，直接无副作用开锁。
于是楚浩直接盘点十大超脱体系。
吞噬星空浑源领主、三世铜棺祭道之上，永生之门，圣王杨大象，龙符古厂长，一世之尊，以及基因锁体系。
凯莎:今日方知我是蝼蚁！
卡尔:什么狗屁幻体，什么终极恐惧，都是屁！
凉冰:幸亏那些存在和我们无关！
随着超神宇宙情绪波动，楚浩一路从一阶基因锁，到先天真圣，在到超脱，超神宇宙响起赞歌。
所有人麻了。
飞卢小说网提醒您：本小说及人物纯属虚构，如有雷同，纯属巧合，切勿模仿。","盘点,曝光",人在超神，开局五阶基因锁被曝光,字数：70万
夏末微凉,https://b.faloo.com/1469503.html,56139,http://img.faloo.com/Novel/332x470/1/1572/001572266.jpg,full/001572266.jpg,月点击：752561,9.8,100,"【飞卢小说网独家签约小说：影视：便利店长，开局干翻乔英子】
林枫穿越到了影视世界，并且是开局就成了便利店店长。
开业的第一天，就碰上的乔英子捏碎方便面被抓包，直接带到仓库里狠狠教育。
随后宋倩也上门捏方便面……
随着便利店越做越大，林枫碰到的人也越来越多。
这里有流金岁月里的蒋南孙，朱锁锁，爱情公寓里里的诺澜，胡一菲，还有魔仙世界的小蓝跟小月！
逐渐的在与这些女人相处的过程中，林枫打造出了世界最大购物中心！
飞卢小说网提醒您：本小说及人物纯属虚构，如有雷同，纯属巧合，切勿模仿。","都市,影视,爱情公",影视：便利店长，开局干翻乔英子,字数：115万
米亚罗,https://b.faloo.com/1364664.html,920382,http://img.faloo.com/Novel/332x470/1/1065/001065400.jpg,full/001065400.jpg,月点击：752634,9.9,2.3万,"【飞卢小说网独家签约小说：港片：我真不想当老大】
一入江湖深似海。
江湖不只是打打杀杀，还有人情世故。
陈东穿越到港片融合世界，变成了和联胜古惑仔，发现大名鼎鼎的“夺命剪刀脚”是自己舅舅，自己还是他的线人。有个这么犀利的舅舅罩着，跑去混矮骡子，这不是有病么？
没有太大野望的他本想靠着“夺命剪刀脚”这个舅舅罩着得过且过。谁曾想.....
“老舅别搞了，我老大被你搞了，我已经成揸fit人了。”
“老舅啊，别抓了，再抓下去我就要当话事人了！”
飞卢小说网提醒您：本小说及人物纯属虚构，如有雷同，纯属巧合，切勿模仿。","爽文,系统,同人",港片：我真不想当老大,字数：371万
战战战战,https://b.faloo.com/1474330.html,45169,http://img.faloo.com/Novel/332x470/1/1579/001579286.jpg,full/001579286.jpg,月点击：752994,9.9,10.1万,"【飞卢小说网独家签约小说：军工：开局大授衔，我成鹰派元帅】
哈工大学生、超级军迷周天一朝穿越到1952年的兔子，靠着前世记忆和军工知识，研制出了56式半自动步枪、107火箭炮、40火箭筒等先进武器装备，助力抗鹰战争的僧里。
随后，周天火箭式晋升国防五所所长。
1955年，周天参加大授衔被授予少将军衔，觉醒鹰派军工系统，从此兔子军工原地起飞。
白象挑起边境争端？
周天：“合成旅直接横推灭掉白象，以后就不会有边境问题了。”
毛熊闹掰挑起事端？
周天：“现在是我们收复毛熊侵占领地的最佳时机……自古以来，毛熊就是我国不可分割的一部分……有意见？问问我手里的五代战机”
越猴子分不清大小王越境闹事？
周天：“我们不和越猴子打巷战，直接射程几百公里的火箭弹洗地灭掉就是了！”
当再次大授衔的时候，周天已经成为一个鹰派军工元帅……
飞卢小说网提醒您：本小说及人物纯属虚构，如有雷同，纯属巧合，切勿模仿。","重生,成长,扮猪吃",军工：开局大授衔，我成鹰派元帅,字数：35万
再来三十,https://b.faloo.com/1413094.html,598458,http://img.faloo.com/Novel/332x470/1/1584/001584573.jpg,full/001584573.jpg,月点击：753168,9.6,7.3万,"【飞卢小说网独家签约小说：洪荒：开局重瞳，拜师截教云霄！】
石晨穿越，意外觉醒了重瞳者体质。
本来是抱着不要拖荒天帝后腿的念头，混个仙帝就完事。
但是没想到他却可以自由穿梭洪荒世界。
洪荒法修命，完美法修性。
性命双修之下，石晨飞快的崛起。
在洪荒世界，他成了诸多圣人争抢的对象。
通天教主：“石晨当为我截教三代首徒！”
元始天尊：“除了石晨之外，截教皆是一些湿生卵化，不通教化之辈！此等福缘，理应入我阐教！”
太上圣人：“石晨为人族，应当来我人教才是！”
西方二圣：“石晨小友，与我西方有缘！”
安澜：“仙之巅，傲世间，有那石晨便是天啊。”
尸骸仙帝：“石晨此子恐怖如斯！！”
诡异始祖：“快跑，荒天帝带..
飞卢小说网提醒您：本小说及人物纯属虚构，如有雷同，纯属巧合，切勿模仿。","爽文,后宫,美女",洪荒：开局重瞳，拜师截教云霄！,字数：299万
码字致富,https://b.faloo.com/1468901.html,45748,http://img.faloo.com/Novel/332x470/1/1571/001571655.jpg,full/001571655.jpg,月点击：753489,9.8,2.9万,"【飞卢小说网独家签约小说：融合小金人，加入女神聊天群】
你也有无法弥补的遗憾吗？
蝴蝶忍：“姐姐在我的面前死亡，那是我一生的遗憾。”
远坂凛：“如果可以的话，我愿意付出一切，改变樱的命运。”
时崎狂三：“如果能回到当年，如果我没有成为精灵，那该有多好。”
高坂桐乃：“额，我只想回到玩黄油被人发现之前。”
白毅：“打钱，上车！”
我是究极生命体·塔尔塔洛斯。
我带你们穿梭时空，改变曾经的遗憾。
飞卢小说网提醒您：本小说及人物纯属虚构，如有雷同，纯属巧合，切勿模仿。","综漫,万界,无限流",融合小金人，加入女神聊天群,字数：70万
咕咕虫,https://b.faloo.com/1461444.html,63049,http://img.faloo.com/Novel/332x470/1/1561/001561763.jpg,full/001561763.jpg,月点击：758604,9.2,2088,"【飞卢小说网独家签约小说：人在综漫，双穿弑神者】
罗光穿越到一个糅杂了DXD，咒术回战，黑暗集会，食尸鬼等世界观的综漫世界。
肉身变小后，直到十二岁时才觉醒金手指，只要修炼，就能够不断变强，并且还附赠一个穿界门功能。
当然作为穿越者，自然不能没有新手大礼包，开局一把歼魔圣剑艾斯特，又能杀敌又能暖床。
很快，罗光就变强了，但是还没秃。
宝月夜宵：“...就算将所有毕业生集合在一起也不是他的对手。”
莉雅丝：“莉雅丝啊莉雅丝，你怎么能这么愚蠢呢。”
支取苍那：“听我说，谢谢你......”
艾斯特：“明明是我先来的！”
飞卢小说网提醒您：本小说及人物纯属虚构，如有雷同，纯属巧合，切勿模仿。","成长,二次元,综漫",人在综漫，双穿弑神者,字数：52万
